name,reading,meaning
座位,ざい,１ 座席の位置。座席の順序。席次。 ２ すわった姿。 ３ 染色体やゲノム上における、遺伝子以外のDNA配列が占める位置。遺伝子の場合は遺伝子座とよばれる。ローカス。
罪悪,ざいあく,道徳や宗教の教えに背くこと。つみ。
在位,ざいい,帝王の位にいること。また、ある地位にいること。また、その期間。
財貨,ざいか,１ 金銭と品物。財物。２ 経済学で、人間の欲望を満たし、人間が支配・処分することのできるもの。有り余るほどあって売買の対象とならないものを自由財、欲望に比して希少性をもち、その獲得になんらかの努力を必要とし、売買の対象となるものを経済財という。財貨。
財界,ざいかい,大企業を中心とした実業家が構成している社会。経済界。
在外,ざいがい,外国に居住・滞在していること。また、外国にあること。
在学,ざいがく,学生・生徒・児童として学校に籍を置くこと。
在郷,ざいきょう,郷里にいること。ざいごう。
在勤,ざいきん,現在、ある勤務に就いていること。特に、地方などで勤務に就いていること。在職。在任。
在家,ざいけ,１ 出家せずに、普通の生活をしながら仏教に帰依すること。また、その人。在俗。２ いなかの家。ざいか。３ 中世、荘園・公領で、農民と耕地とを一体のものとして賦課の対象としたもの。東国や九州に多くみられる。
財形,ざいけい,勤労者の財産形成促進を目的として設けられた貯蓄制度。
財源,ざいげん,収入を生み出すもと。
在庫,ざいこ,１ 商品が倉庫などにあること。また、その商品。２ 原材料・仕掛品・製品などが企業に保有されていること。また、それらの財貨。
在校,ざいこう,１ 学生・生徒・児童として、学校に籍が置いてあること。在学。２ 教師や学生・生徒・児童が学校内にいること。
財産,ざいさん,１ 個人や団体などの所有している、金銭・有価証券や土地・家屋・物品などの金銭的な価値のあるものの総称。資産。２ ある主体に属する積極財産（資産）と消極財産（負債）の総体。３ あるものにとって、価値あるもの。金銭的価値にも精神的価値にもいう。
在室,ざいしつ,室内にいること。
材質,ざいしつ,１ 木材の性質。２ 材料としての性質。
材種,ざいしゅ,１ 木材を用途・形・寸法などに応じて区分した種類。２ 材料の種類。
在住,ざいじゅう,その地に住んでいること。
在所,ざいしょ,１ 人が住んでいる所。また、物が存在する所。ありか。２ 郷里。くにもと。３ 都会から離れた地方。田舎。ざい。
罪状,ざいじょう,問われている罪の具体的な事実。
在職,ざいしょく,ある職務についていること。
財政,ざいせい,１ 国または地方公共団体が、その存立を維持し活動するために必要な財力を取得し、これを管理・処分する一切の作用。２ 個人・家庭・団体などの経済状態。かねまわり。
在席,ざいせき,１ 職場の自分の席についていること。２ 職場に自分の席があること。在勤。
在籍,ざいせき,団体・学校などに属する者として登録されていること。
罪跡,ざいせき,犯罪の証拠となる痕跡(こんせき)。
座板,ざいた,１ いすの、腰を下ろす部分の板。２ 床板(ゆかいた)。
在宅,ざいたく,外出しないで自分の家にいること。
財団,ざいだん,１ 一定の目的のために結合された財産の集合体。抵当権の目的とされる工場財団・鉱業財団など。２ 「財団法人」の略。
在地,ざいち,１ 住んでいる土地。２ 田舎の土地。在所。在郷。
在中,ざいちゅう,中に書類・金品などが入っていること。また、そのことを封筒や包みなどの表に示す語。
在日,ざいにち,外国人が日本に滞在、または居住していること。
在任,ざいにん,任務に就いていること。また、任地にあること。
罪人,ざいにん,罪を犯した人。つみびと。
在否,ざいひ,いるかいないかということ。在宅と不在。
財物,ざいぶつ,１ 金銭と品物。財貨。たから。ざいもつ。２ 刑法上、窃盗・強盗・詐欺・恐喝・横領などの財産犯の客体となるもの。
財宝,ざいほう,財産や宝物。財産となる価値の高い物品。宝物。
在民,ざいみん,人民の側にあること。国民がもっていること。
財務,ざいむ,財政に関する事務。
罪名,ざいめい,１ 殺人罪・放火罪のように、犯罪の種類を表す名称。２ その罪を犯したといううわさ。
材木,ざいもく,樹木を切り出して建築物・製品材料などに用いられるようにしたもの。ふつう、角板や板の形をしているものをいう。木材。
在野,ざいや,１ 公職に就かないで民間にいること。２ 与党に対して、野党の立場にあること。
在来,ざいらい,これまであったことや、行われていたこと。また、そのもの。今までどおり。
在留,ざいりゅう,ある期間、ある土地にとどまって住むこと。特に、外国に居住する場合にいう。
材料,ざいりょう,１ ものを作るとき、そのもとにするもの。２ 研究や調査、または判断などを裏づける証拠とするもの。３ 芸術的表現の対象になるもの。題材・素材。４ 相場を動かすような要因。
財力,ざいりょく,１ 財産があることによって生じる物事をなしうる力。金力。２ 費用を負担しうる能力。資力。経済力。
座員,ざいん,演劇の一座に属している人。
座学,ざがく,演習や訓練などの実技に対して、講義形式の学科のこと。
座興,ざきょう,１ 宴席などで、その場に興を添えるための芸や遊戯。２ その場かぎりの冗談や戯れ。
雑魚,ざこ,１ いろいろな種類の入り交じった小魚。また、小さい魚。じゃこ。２ 地位の低い者、取るに足りない者をたとえていう語。小物。
座高,ざこう,すわったときの上体の高さ。上体をまっすぐにしていすに腰掛けたときの、座面から頭頂までの高さをいう。
座敷,ざしき,１ 畳を敷きつめた部屋。特に、客間。２ 宴会の席。酒席。また、酒席での応対。３ 芸者・芸人などが招かれる酒席。４ しとね・円座・上げ畳など、すわるための座を敷くこと。また、そのようにした場所。通常の板敷きに対していう。
座礁,ざしょう,船が暗礁に乗り上げること。
挫傷,ざしょう,外部から鈍力が加えられたとき、皮膚の表面には傷がつかないで、内部組織や臓器に損傷が生じること。うちみ。挫創。
座州,ざす,船が浅瀬に乗り上げること。
座席,ざせき,すわる場所。すわる席。席。
挫折,ざせつ,仕事や計画などが、中途で失敗しだめになること。また、そのために意欲・気力をなくすこと。
座像,ざぞう,すわっている姿の像。
座卓,ざたく,畳・床にすわって使う机。
座長,ざちょう,１ 芝居・見世物・演芸などの一座の長。座頭(ざがしら)。２ 座談会や懇談会などで、会の進行や取りまとめなどをする役。
雑役,ざつえき,主な業務以外の種々雑多な仕事。
雑益,ざつえき,特定の勘定科目に該当しない収入。
雑音,ざつおん,１ 不規則で不愉快に感じられる音。うるさい音。２ ラジオ・テレビ・電話などの聴取のさまたげとなる音。また、電気回路で、目的とする信号電流以外の、通信を妨害する電流。ノイズ。３ うわさや無責任な意見。
雑貨,ざっか,日常生活に必要なこまごました品物。
雑学,ざつがく,多方面にわたるまとまりのない知識や学問。また、学問とは関係のない雑多な知識。
雑感,ざっかん,雑多な感想。まとまりのない思いついたままの感想。とりとめのない感想。
雑観,ざっかん,新聞などで、記者がニュース対象から感じた印象や周囲の状況、関係者の反応などを記事にしたもの。
雑記,ざっき,いろいろな事柄を書きつけること。また、書きつけたもの。
雑技,ざつぎ,１ 民間に行われるさまざまな技芸。特に奈良時代、中国から伝来した曲芸・物まねなどをさすことが多い。雑芸(ぞうげい)。２ 取るに足らない技芸。３ 中国で、奇術や曲芸などを演じるもの。
雑居,ざっきょ,１ 種々のものが1か所に入りまじって存在すること。２ 一つの家に多くの家族が居住すること。３ 一つの部屋に何人もが居住すること。４ 同一地域にいろいろな人種が入り交じって居住すること。
雑業,ざつぎょう,種々雑多な仕事や職業。また、一般の職業の分類に入れにくい職業。
雑菌,ざっきん,種々雑多な細菌などの微生物。特に、微生物や組織などの培養基中に他から混入した、培養の目的とするもの以外の微生物。
雑具,ざつぐ,種々雑多な道具。
雑誌,ざっし,１ 雑多な事柄を記載した書物。２ 複数の筆者が書き、定期的に刊行される出版物。週刊・月刊・季刊などがある。マガジン。
雑事,ざつじ,本来の仕事以外のいろいろな用事。取るに足らない雑多な事柄。
雑種,ざっしゅ,１ いろいろな種類のものが入りまじっていること。また、そのもの。２ 品種など系統の異なる雌雄の交配によってできた個体。遺伝子に関してヘテロの状態であるもの。
雑書,ざっしょ,１ 図書分類上、どの部門にも入らない書物。雑本。２ 雑多なことを記載した書物。雑本。３ 江戸時代、相性(あいしょう)・開運その他の俗説を記した書物。
雑色,ざっしょく,いろいろな色がまじった色。また、さまざまな色。
雑食,ざっしょく,植物性のものも動物性のものも食べること。
雑然,ざつぜん,いろいろなものが入り乱れて、まとまりのないさま。
雑草,ざっそう,１ 自然に生えるいろいろな草。また、名も知らない雑多な草。２ 農耕地や庭などで、栽培目的の植物以外の草。３ 生命力・生活力が強いことのたとえ。
雑則,ざっそく,本則以外のいろいろな細かい事項についての規則。
雑多,ざった,いろいろなものが入りまじっていること。また、そのさま。
雑談,ざつだん,さまざまな内容のことを気楽に話すこと。また、その話。とりとめのない話。
雑踏,ざっとう,多数の人で込み合うこと。人込み。
雑念,ざつねん,気持ちの集中を妨げるいろいろな思い。
雑嚢,ざつのう,雑多なものを入れる袋。肩から掛ける布製のかばん。
雑費,ざっぴ,主要な用途以外のこまごました費用。一つの部類にまとめられない種々雑多な費用。
雑筆,ざっぴつ,雑多なことを書き記すこと。また、その書いたもの。雑記。雑録。
雑品,ざっぴん,こまごました、いろいろな品物。
雑文,ざつぶん,専門的でない、気軽に書き流した文章。
雑務,ざつむ,こまごましたいろいろの用務。ぞうむ。
雑用,ざつよう,１ こまごました、いろいろの用事。ぞうよう。２ こまごましたものの費用。雑費。
座標,ざひょう,"点の位置を表す数、または数の組。平面上の点Pの座標は、直交する二直線への距離aとbで表し、P（a,b）と書く。"
挫滅,ざめつ,外部から強い衝撃、圧迫を受けて内部の組織が破壊されること。
座面,ざめん,椅子の、腰を下ろす部分。
座右,ざゆう,１ 座っている所のかたわら。手近な所。身近。ざう。２ 手紙文で、相手を直接さすのをはばかって代わりに用いる語。また、敬意を表す脇付の語。
座料,ざりょう,１ 座席代。席料。２ 芸人がその座敷をつとめた料金。
笊法,ざるほう,笊の目のように粗く、抜け道がたくさんある不備な法律。
座論,ざろん,座して議論すること。座上の論議。また、実行を伴わない口先だけの議論。
残骸,ざんがい,１ 戦場や災害地などにそのまま残された死体。２ 原形をとどめないほどに破壊された状態で残っているもの。
残額,ざんがく,残りの数量または金額。残(ざん)。
残寒,ざんかん,寒(かん)が明けても残る寒さ。余寒。
慙愧,ざんき,自分の見苦しさや過ちを反省して、心に深く恥じること。
残虐,ざんぎゃく,人や生き物に対してする行為のむごたらしいこと。また、そのさま。
残響,ざんきょう,音源が振動をやめたあとも、天井や壁などからの反射が繰り返されて、音が引き続き聞こえる現象。
残業,ざんぎょう,規定の勤務時間を過ぎてからも残って仕事をすること。また、その仕事。超過勤務。
残金,ざんきん,１ 支出後に手もとに残った金。２ 支払うべき金額の未払い分。
讒言,ざんげん,事実を曲げたり、ありもしない事柄を作り上げたりして、その人のことを目上の人に悪く言うこと。
残光,ざんこう,消え残っている光。多く、日没後なお空に残っている光をいう。
残香,ざんこう,あとに残っている香。うつり香。残り香。
塹壕,ざんごう,１ 戦場で、歩兵が敵弾を避けるために作る防御施設。溝を掘り、前方に掘った土や土嚢(どのう)を積み上げたもの。２ 城やとりでの周囲の堀。
残酷,ざんこく,無慈悲でむごたらしいこと。まともに見ていられないようなひどいやり方のさま。
残痕,ざんこん,残っている跡。痕跡。
惨殺,ざんさつ,むごたらしい方法で殺すこと。
斬殺,ざんさつ,人をきり殺すこと。
惨死,ざんし,むごたらしく死ぬこと。さんし。
残滓,ざんし,残りかす。
暫時,ざんじ,少しの間。しばらく。副詞的にも用いる。
斬首,ざんしゅ,首をきること。首をきる刑。また、きったその首。
残暑,ざんしょ,立秋を過ぎてもなお残る暑さ。
斬新,ざんしん,趣向や発想などがきわだって新しいさま。
讒訴,ざんそ,１ 他人をおとしいれようとして、事実を曲げて言いつけること。２ 陰で人の悪口を言うこと。陰口。
残像,ざんぞう,外部刺激がやんだあとにも残る感覚興奮のこと。主として視覚についていう。
残存,ざんそん,なくならないで残っていること。同類の多くがなくなったあとも、なお残っていること。
残高,ざんだか,収支または貸借の差し引き計算をして残った金額。残金。
残置,ざんち,残しておくこと。
暫定,ざんてい,正式な決定がなされるまで、仮の措置として、とりあえず定めること。
残土,ざんど,土木工事などで出る不要な土。
残党,ざんとう,１ 敵に敗れた一党のうちで、わずかに生き残っている者たち。２ 一時期勢力をもっていて、のちに弱体化した集団などの生き残り。
残尿,ざんにょう,排尿後に、なお膀胱(ぼうこう)内に残っている尿。
残忍,ざんにん,無慈悲なことを平気ですること。また、そのさま。
残念,ざんねん,１ もの足りなく感じること。あきらめきれないこと。また、そのさま。２ 悔しく思うこと。また、そのさま。無念。
惨敗,ざんぱい,ひどい負け方をすること。さんぱい。
残飯,ざんぱん,食べ残しのめし・料理。
残品,ざんぴん,売れ残った品物。
残物,ざんぶつ,のこりもの。あまりもの。
残片,ざんぺん,のこったきれはし。
讒謗,ざんぼう,人をあしざまに言うこと。
残務,ざんむ,未処理で残った事務。
残夢,ざんむ,明け方に、うとうとと見ている夢。目が覚めてもなお夢心地でいること。
残余,ざんよ,のこり。あまり。
残留,ざんりゅう,残りとどまること。なくならずに残っていること。
在院,ざいいん,病院など「院」と名のつく所にいること。入院していること。
在営,ざいえい,兵営の中にいること。軍務に服していること。また、その期間。
在役,ざいえき,１ 懲役・兵役などに服していること。２ 任務に就いていること。
在園,ざいえん,保育園・幼稚園など「園」と呼ばれる施設に在籍していること。
在欧,ざいおう,欧州（ヨーロッパ）に滞在・駐在すること。
在荷,ざいか,商店・倉庫・工場などに貨物や商品があること。また、その貨物や商品。在庫品。
罪科,ざいか,１ 法律や道徳、また、宗教などのおきてに背いた罪。２ 法律により処罰すること。しおき。
罪過,ざいか,法律や道徳に背いた行い。つみ。あやまち。罪悪。
罪魁,ざいかい,犯罪者のかしら。悪事の張本人。
在方,ざいかた,いなか。在所。在。
在監,ざいかん,刑務所や拘置所などの刑事施設に収容され、身柄を拘束されていること。監獄法の改廃に伴い、現在は「収容」などの語が用いられる。
罪咎,ざいきゅう,つみととが。罪科。
在京,ざいきょう,都に滞在・居住していること。古くは京都、現在では東京に滞在・居住していること。
剤形,ざいけい,医薬品を投与方法に適した、錠剤・軟膏(なんこう)剤・エキス剤などにすること。
罪業,ざいごう,仏語。罪となる悪い行い。
在国,ざいこく,１ 都にではなく故郷にいること。在郷(ざいきょう)。２ 江戸時代、大名やその家臣が自分の領国にいること。
在獄,ざいごく,捕らわれて獄にいること。
罪質,ざいしつ,犯した罪の中身や度合い。
在社,ざいしゃ,１ 会社の中にいること。２ その会社に在職していること。
罪種,ざいしゅ,犯罪の種類。
罪囚,ざいしゅう,獄舎につながれた罪人。めしゅうど。囚人。囚徒。
罪証,ざいしょう,犯罪の証拠。
財相,ざいしょう,財務大臣のこと。
罪数,ざいすう,ある一連の犯行による罪の数。
在世,ざいせ,１ 世に生きていること。ざいせい。２ 釈迦が生存していたとき。
材積,ざいせき,木材・石材などの体積。
罪責,ざいせき,罪を犯した責任。
在線,ざいせん,ある線路区間に列車が存在すること。
在俗,ざいぞく,出家しないで俗人の状態でいること。また、その人。在家(ざいけ)。
在隊,ざいたい,軍隊に籍のあること。
罪体,ざいたい,犯罪が行われた物体。殺人罪における死体、放火罪における焼失した家屋など。
在庁,ざいちょう,１ 官庁に勤めていること。２ 出勤して役所にいること。
在朝,ざいちょう,朝廷に仕えていること。また、官職についていること。
在天,ざいてん,神・霊魂などが天上にあること。
在島,ざいとう,島に滞在し、または住んでいること。
財投,ざいとう,国が政策目的を推進するため、財政政策の一環として行う投資および融資。社会資本整備や政策金融などの分野に投入される。毎年度、財政投融資計画にまとめられ、財政融資資金・産業投資特別会計・政府保証債および政府保証借入金を原資として、特別会計・政府金融機関・独立行政法人・特殊会社・地方公共団体などが運用対象になっている。また、財政融資資金による国債引き受けも財政投融資に含まれる。
財嚢,ざいのう,１ 金銭を入れる袋。財布。２ 持ち金(がね)のすべて。また、金銭。
財閥,ざいばつ,１ 第二次大戦前の日本で、コンツェルンの形態をとり、同族の閉鎖的な所有・支配のもとに、持株会社を中核として多角的経営を行っていた独占的巨大企業集団。三井・三菱・住友・安田など。２ 金持ちのこと。
在判,ざいはん,１ 古文書の写しなどで、原本のほうにはここに花押(かおう)が書かれているということを示す語。ありはん。２ 茶の湯で、香合、水指など茶器に、朱漆などで花押や署名が直書してあること。３ 花押を書くこと。または印を押すこと。
在米,ざいべい,他国の人がアメリカに滞在、または居住していること。
在名,ざいみょう,１ 在所の名。ざいめい。２ 住む土地の名をとってつけた名前。ざいめい。
在銘,ざいめい,刀剣・器物などに、その作者の名が記してあること。有銘。
財用,ざいよう,１ 財貨の用途。２ もとで。費用。
罪累,ざいるい,１ 罪のまきぞえになること。連座。２ 罪を重ねること。
罪例,ざいれい,犯罪の実例。
座五,ざご,俳句で、末の5文字。下(しも)五。
座功,ざこう,連歌などの興行や一座に参加して経験を積むこと。
挫骨,ざこつ,骨をくじくこと。また、くじいた骨。
座所,ざしょ,貴人などの座のある場所。御座所。
座主,ざす,１ 学・徳ともにすぐれた一座の上首。２ 大寺を統括する首席の僧職。延暦寺の天台座主に始まり、金剛峰寺・醍醐寺などで官命によって任ぜられたが、明治以後は私称。
座前,ざぜん,１ 座席のまえ。２ 手紙で、あて名の脇付(わきづけ)に用いて敬意を表す語。
挫創,ざそう,鈍体による打撃や圧迫によって生じる損傷で、皮膚が断裂し傷口が開いた状態をいう。傷口がないものは挫傷という。打撲創。
座談,ざだん,１ すわって気楽に話し合うこと。２ その場だけの話。
座中,ざちゅう,１ 会合している一座の中。また、その一座。２ 芸能の一座の仲間。
雑詠,ざつえい,詩歌や俳句で、特に題をきめず、自由な題材で詠むこと。また、その作品。
雑楽,ざつがく,雅楽以外の種々の音楽の総称。
雑株,ざつかぶ,主要銘柄以外のいろいろな株式。人気の薄い株式。
雑器,ざっき,１ 雑多な器物。２ 神棚に供える供物を盛る小さな木皿(きざら)。
雑曲,ざっきょく,１ 雅楽以外のいろいろな音曲。２ 民間のはやりうた。流行歌。俗曲。
雑劇,ざつげき,１ 中国、宋代に始まる演劇の形態の名。時代により、その内容が異なる。宋代では滑稽風刺劇、元代では歌劇である元曲、明・清代では新形式の短編劇をいう。２ 日本で、能・狂言・舞楽などに対し、通俗的な演劇・演芸。
雑件,ざっけん,こまごまとしたいろいろな事件や用件。
雑犬,ざっけん,雑種の犬。
雑交,ざっこう,１ いりまじること。２ 遺伝的に異なる系統・品種などの間で交配を行うこと。
雑考,ざっこう,系統だっていない、種々の考察や考証。
雑穀,ざっこく,米・麦以外の穀類の総称。豆やそば・黍(きび)・粟(あわ)など。
雑言,ざつごん,漢詩で、各句の字数が一定していない詩体。雑体。
雑載,ざっさい,新聞・雑誌などに雑多な細かい記事をのせること。また、その欄。
雑纂,ざっさん,雑多な記録や文章を集めること。また、そのように編集した書物。
雑紙,ざっし,雑用紙。また、鼻をかんだりするのに使う下級の紙。鼻紙。ぞうし。
雑酒,ざっしゅ,酒税法上、清酒・合成清酒・焼酎(しょうちゅう)・みりん・ビール・果実酒類・ウイスキー類・スピリッツ類・リキュール類に属さない酒類。発泡酒の類。
雑税,ざつぜい,基本的な租税以外の種々の税。
雑節,ざっせつ,二十四節気以外に、季節の変化の目安とする特定の日の総称。節分・八十八夜・入梅・半夏生(はんげしょう)・二百十日・土用・彼岸など。
雑説,ざっせつ,いろいろな説。さまざまな意見。
雑訴,ざっそ,いろいろの訴訟。
雑卒,ざっそつ,身分の低い兵士。雑兵(ぞうひょう)。
雑損,ざっそん,１ 特定の勘定科目に該当しない損失。２ 所得税の控除対象となる、災害・盗難または横領による一時的な損失。
雑題,ざつだい,１ 雑多な種類の問題・題目。２ どの部類にも入らない問題・題目。
