name,reading,meaning
叙階,じょかい,カトリック教会で、助祭・司祭・司教などの聖職位を授けること。また、按手(あんしゅ)によって聖別するその儀式。叙階の秘跡。祝聖。
女官,じょかん,宮中に仕える女性。にょかん。にょうかん。
女監,じょかん,女囚を収容する監房・獄舎。
女鑑,じょかん,女性の手本。女のかがみ。
女給,じょきゅう,カフェ・バー・キャバレーなどで、客の接待に当たった女性。
助教,じょきょう,１ 大学・高等専門学校の教員の職階の一。准教授の下。平成17年（2005）の学校教育法改正で新設。「専攻分野について、教育上、研究上又は実務上の知識及び能力を有する者であって、学生を教授し、その研究を指導し、又は研究に従事する」と規定される。平成19年（2007）4月施行。２ 教授・教諭を補佐する役。また、その人。
序曲,じょきょく,１ オペラ・オラトリオ・バレエ音楽などの最初に演奏される器楽曲。主要部への導入の役割を果たす。２ 物事の始まりを示す事柄。
除菌,じょきん,細菌を取り除くこと。
耳翼,じよく,みみたぶ。耳殻(じかく)。
辱知,じょくち,知り合いであることを、へりくだっていう語。辱交。
褥婦,じょくふ,出産後間もなく、まだ産褥にある女性。産婦。
辱命,じょくめい,ありがたい命令。また、命令をありがたく受けること。
辱友,じょくゆう,目上の友に対して自分をへりくだっていう語。
縟礼,じょくれい,必要以上にわずらわしい礼儀作法。
女訓,じょくん,女性のための戒めや教訓。
女系,じょけい,女子だけで継承していく系統。また、母方の血筋。
如月,じょげつ,陰暦2月の異称。きさらぎ。
女権,じょけん,女性の権利。特に、政治上・社会上・法律上の権利にいう。
助語,じょご,１ 助けになるような意見や言葉を、そばから言ってやること。また、その言葉。じょごん。２ 助詞。また、助詞・助動詞の総称。３ 漢文で、名詞・動詞・形容詞などのいわゆる実字・虚字を助ける語をいう。断定・詠嘆・疑問などを表す「也」「矣」「乎」や、前置詞の「於」「与」、疑問詞の「何」「誰」などがある。助辞。虚字。
女皇,じょこう,女性の皇帝。女帝。
除号,じょごう,除法を表す記号。「÷」の記号。
鋤骨,じょこつ,頭蓋骨(とうがいこつ)の中で鼻中隔(びちゅうかく)の一部をなす骨。哺乳類では鋤(すき)状。
助祭,じょさい,カトリック教会の聖職者の位の一。司祭の次の位。
除算,じょさん,割り算。除法。
助士,じょし,交通機関などで、業務の正式の担当者を補助する職種。また、その人。助手。
助詞,じょし,品詞の一。付属語のうち、活用のないもの。常に、自立語または自立語に付属語の付いたものに付属し、その語句と他の語句との関係を示したり、陳述に一定の意味を加えたりする。格助詞・副助詞・係助詞・接続助詞・終助詞・間投助詞（さらに準体助詞・並立助詞その他）などに分類される。古くから助動詞あるいは接尾語などとともに「てにをは」とよばれた。
序詩,じょし,序として添えられた詩。
助字,じょじ,漢文で、名詞・動詞・形容詞などのいわゆる実字・虚字を助ける語をいう。断定・詠嘆・疑問などを表す「也」「矣」「乎」や、前置詞の「於」「与」、疑問詞の「何」「誰」などがある。助辞。虚字。
助辞,じょじ,１ 助詞。また、助詞・助動詞の総称。２ 漢文で、名詞・動詞・形容詞などのいわゆる実字・虚字を助ける語をいう。断定・詠嘆・疑問などを表す「也」「矣」「乎」や、前置詞の「於」「与」、疑問詞の「何」「誰」などがある。助辞。虚字。
序次,じょじ,物事の順序。次第。
女囚,じょしゅう,女の囚人。
女将,じょしょう,旅館・料理屋・居酒屋などの女主人。じょしょう。
叙上,じょじょう,前に述べたこと。上述。前述。
如上,じょじょう,前に述べたとおり。上述。前述。
女神,じょしん,女性の神。めがみ。
女人,じょじん,女性。おんな。にょにん。
序数,じょすう,物の順序を表す数。順序数。
除数,じょすう,割り算で、割るほうの数。a÷bのb。
女声,じょせい,声楽で、女性の受け持つ声部。ソプラノ・アルトなど。
除染,じょせん,施設や機器・着衣などが放射性物質や有害化学物質などによって汚染された際に、薬品などを使ってそれを取り除くこと。
助奏,じょそう,独奏または独唱部の効果を高めるため、伴奏楽器で奏される主旋律と相競うように奏される助奏。
助走,じょそう,陸上競技の跳躍や投擲(とうてき)、体操競技の跳馬などで、踏み切りや投擲の位置まで勢いをつけるために走ること。
序奏,じょそう,楽曲で、主要部を導入する役割の部分。イントロダクション。導入部。
除喪,じょそう,喪に服している期間が終わって喪服を脱ぐこと。除服。いみあけ。
女体,じょたい,女性のからだ。にょたい。
助炭,じょたん,枠に和紙を張ったもので、火持ちをよくするため、火鉢などを覆う道具。
女帝,じょてい,女性の皇帝。にょてい。
女童,じょどう,女の子供。童女。
女徳,じょとく,女性に備っている徳性。また、女性として身につけておくべき徳。婦徳。
除伐,じょばつ,幼齢林の手入れとして、不要な樹木を切り除くこと。
序盤,じょばん,１ 囲碁・将棋で、対局開始後の、碁では布石、将棋では駒組みの段階。また、その局面。２ ひと続きの物事のはじめの段階。
除服,じょぶく,喪の期間が終わって、喪服を脱ぐこと。また、喪が明けること。いみあけ。
叙法,じょほう,１ 言い表し方。文章などの叙述の方法。２ 叙位の方法。位階を授けるやり方。
除法,じょほう,ある数や式を零以外の他の数や式で割って商を求める計算法。割り算。
徐脈,じょみゃく,心臓の拍動の緩やかなもの。ふつう、1分間の脈拍数が60以下の場合をいう。
除夜,じょや,1年の最後の夜。大晦日(おおみそか)の夜。除夕(じょせき)。
助役,じょやく,１ 市町村・特別区などで、長を補佐し、その職務を代理した特別職の地方公務員。平成19年（2007）地方自治法の改正により廃止され、副市町村長制度に移行。２ 鉄道の職制で、駅長などを補佐する職。また、その職員。
除雄,じょゆう,自花受粉を防ぐため、花の雄性機能を除く操作。つぼみから雄しべを取り除く方法、熱処理をして花粉の機能を失わせる方法など。
女礼,じょれい,女性として心得ておくべき礼儀作法。女礼式。
鋤簾,じょれん,土砂・ごみなどをかき寄せる用具。長い柄の先に、竹で編んだ箕(み)、または歯をきざんだ鉄板を取り付けたもの。
如露,じょろ,植木などに水をやるのに使う道具。じょろ。
助老,じょろう,老僧が座禅のときにひじをついて休む台。脇息(きょうそく)に似たもの。また、あごをのせる小さいつえにもいう。
事理,じり,１ 事の筋道。道理。２ 仏語。事と理。すなわち、外相(げそう)である相対的差別の現象と、その本体である絶対平等の真理。
自利,じり,１ 自分の利益。２ 仏語。自力の修行によってその功徳・利益を自分一人で受け取ること。
寺領,じりょう,寺の所有する領地。
字林,じりん,漢字を集めて解釈した書物。字書。
字類,じるい,漢字・漢語を分類してまとめたもの。字書。
地類,じるい,１ 同族・親族の一種。古い分家や遠い親類などを含めた地縁のある家々。地親類(じしんるい)。合地(あいじ)。地分かれ。地名(じみょう)。２ 地上にある万物。ちるい。
時令,じれい,１ 一年中の行事。年中行事。２ 時節。時候。
事歴,じれき,物事がこれまでたどってきた道すじ。物事の来歴。
地炉,じろ,地上の炉。または床を切って設けた炉。いろり。
痔瘻,じろう,肛門の周囲に管状の穴があき、膿(うみ)などの出る痔疾の一種。蓮痔(はすぢ)。穴(あな)痔。
耳漏,じろう,中耳、また、外耳道の一部が化膿(かのう)した際に耳から膿(うみ)が出ること。耳垂れ。
耳聾,じろう,耳が聞こえないこと。
地牢,じろう,地下に設けた牢。地下牢。
地蝋,じろう,天然に産出する蝋状の有機物。常温では半固体。ろうそくなどの原料とする。
時論,じろん,１ 時事についての議論。２ その時代の世論。当代一般の世論。
磁歪,じわい,強磁性体が磁化すると、その大きさの100万分の1程度に変形をきたす現象。磁気ひずみ。
塵埃,じんあい,１ ちりとほこり。２ 世の中の、もろもろの汚れたもの。俗世間の事柄。
腎盂,じんう,腎臓と尿管の接続部で、漏斗状に広がっている部分。腎臓からの尿が集まる所。腎盤。
陣雲,じんうん,戦場の空に広がる雲。
陣営,じんえい,１ 戦場で、軍勢が集まって駐屯している本拠地。陣屋。陣所。軍営。２ 立場によって結束する、それぞれの勢力の集まり。
塵縁,じんえん,俗世間のわずらわしい関係。世俗とのつながり。
人屋,じんおく,人の住む家。人家。
仁恩,じんおん,思いやりの気持ちから与える恩。めぐみ。いつくしみ。
人我,じんが,他人と、自分。にんが。
人海,じんかい,人の多いことを海にたとえていう語。
人界,じんかい,人の住んでいる世界。人間界。
塵灰,じんかい,ちりと、はい。
塵界,じんかい,汚れた俗世間。
塵外,じんがい,俗世間のわずらわしさを離れた所。塵界の外。
腎管,じんかん,無脊椎動物にみられる排出器官。体腔中にらっぱ状に開く腎口、排出物を濃縮・移送する細管部、体外に開く排出口からなる。環形動物では体節ごとに一対ずつあり、体節器ともいう。
人気,じんき,１ その地域の人々の気風。にんき。２ 人々の受け取りよう。気受け。評判。にんき。３ 群集した人々の熱気。また、人々の気配。
神器,じんぎ,神から受け伝えた宝器。特に、三種の神器。
神祇,じんぎ,天の神と地の神。天神地祇。
人境,じんきょう,人の住んでいる所。人里。
甚句,じんく,民謡の一。多く七・七・七・五の4句形式で、節は地方によって異なる。江戸末期から流行。越後甚句・米山(よねやま)甚句・名古屋甚句・博多甚句・相撲甚句など。「地(じ)の句」「神供(じんく)」の意からとも、また、越後国の甚九という人名からともいうが未詳。
神供,じんく,１ 神への供え物。供物(くもつ)。２ 密教で、修法などを行じるとき、道場外に壇を設けて十二天や鬼神に供養する作法。
神宮,じんぐう,１ 神を祭った宮殿。２ 格式の高い神社の称号。また、その称号をもった神社。熱田神宮・平安神宮・明治神宮など。
人君,じんくん,人の君たるもの。君主。きみ。
仁君,じんくん,慈しみ深い君主。仁徳を備えた君主。
仁恵,じんけい,思いやりの心と、恵み。
人血,じんけつ,人の血液。
人絹,じんけん,天然の絹糸をまねてつくった化学繊維。綿花・木材パルプなどの繊維素を薬品で溶かして加工したレーヨン・アセテートの長繊維をいう。
人言,じんげん,１ 人の話すことば。人語。２ 世間のうわさ。世人の言。
人後,じんご,他人のうしろ。他人より下位。
壬午,じんご,干支(えと)の一。みずのえうま。
陣伍,じんご,軍隊の陣立て。隊伍。
人皇,じんこう,神代の神々に対して、神武天皇以後の天皇をいう。にんのう。じんのう。
塵垢,じんこう,１ ちりとあか。よごれ。２ 世俗の事柄。わずらわしい俗事。
沈香,じんこう,１ ジンチョウゲ科の常緑高木。熱帯地方に産する。葉は楕円形。花は白く、香りがある。２ 1からとった香料。生木または古木を土中に埋め、腐敗させて製したもの。最優品を伽羅(きゃら)という。沈水香。じん。
人骨,じんこつ,人間のほね。
人災,じんさい,人間の不注意や怠慢が原因で起こる災害。水害・地震などで、十分な対策を講じておかなかったためにこうむる災害をいう。
人士,じんし,地位や教養のある人。
塵事,じんじ,世間のわずらわしい俗事。
人日,じんじつ,五節句の一。陰暦正月7日の称。七草粥(ななくさがゆ)を食べる風習がある。
人車,じんしゃ,１ 人力で動かす車。人力車。２ 人車鉄道の車両。３ 人と車。
仁者,じんしゃ,１ 情け深い人。２ 儒教の説く仁徳を備えた人。仁人。
神社,じんじゃ,神道の神を祭り、祭祀(さいし)や参拝のための施設のある所。また、その建物。やしろ。おみや。
人主,じんしゅ,人君。君主。きみ。
人種,じんしゅ,１ 人類を骨格・皮膚・毛髪などの形質的特徴によって分けた区分。一般的には皮膚の色により、コーカソイド（白色人種）・モンゴロイド（黄色人種）・ニグロイド（黒色人種）に大別するが、この三大別に入らない集団も多い。２ 人をその社会的地位・生活習慣・職業や気質などによって分類していう言い方。
人獣,じんじゅう,人間とけもの。人間とそれ以外の動物。
陣所,じんしょ,陣営。陣屋。
仁恕,じんじょ,１ 情け深く、思いやりがあること。２ 相手をあわれんで罪を許すこと。
人証,じんしょう,裁判で、証人・鑑定人・当事者本人の供述で証拠資料とされるもの。
仁心,じんしん,人を思いやる心。
塵心,じんしん,俗塵に汚れた心。俗世間の名利をむさぼる心。俗心。
仁人,じんじん,思いやりの心を備えた人。仁者。
神水,じんすい,１ 神前に供える水。また、誓いのしるしとして神前で飲む水。２ 霊験ある水。神聖な水。３ 陰暦5月5日の午(うま)の時に降った雨が竹の節にたまったもの。この水で薬を製するとよく効くという。
神通,じんずう,どんなことも自由自在になし得る、計り知れない不思議な働き・力。
人世,じんせい,人間の生きていく世の中。世間。
仁政,じんせい,恵み深い、思いやりのある政治。
塵世,じんせい,汚れた世の中。俗世間。
靭性,じんせい,固体のもつ性質の一。材質の粘り強さ。外力によって破壊されにくい性質。
人税,じんぜい,所得税・相続税などのように、所得や財産の帰属する人を対象にして課される租税。
塵俗,じんぞく,けがれた俗世。塵界。
靭帯,じんたい,１ 骨格の各部分をつなぎ、関節の運動を滑らかにしたり制限したりする、強い弾力性のある線維性の組織。２ 二枚貝類で、2枚の貝殻をつなげる帯状の弾力性のある組織。貝柱に拮抗して貝殻を開く働きをする。
人台,じんだい,衣服の製作や陳列などに用いる人体の模型。ボディー。ドレスフォーム。スタン。
陣代,じんだい,室町時代以後、主君の代理として戦陣に赴いた役。また、主君が幼少のとき、一族または老臣などで軍務や政務を統轄した者。軍代。
神大,じんだい,神奈川大学の俗称。
塵中,じんちゅう,１ ちりのなか。２ けがれた世。俗世。
尽忠,じんちゅう,忠義を尽くすこと。国家や君主に対して真心を尽くして仕えること。
陣中,じんちゅう,陣地・陣営の中。また、戦場。
陣痛,じんつう,１ 分娩(ぶんべん)の際に規則的に反復して起こる、子宮の収縮およびそれに伴う痛み。２ 物事を実現させるための苦労。生みの苦しみ。
人定,じんてい,１ 人が定めること。人為的に制定すること。２ まちがいなくその人であるかどうかを確かめること。
人頭,じんとう,１ 人のあたま。２ あたまかず。人数。
陣内,じんない,１ 陣地の中。２ 陣屋の中。
人肉,じんにく,人間の肉。
人乳,じんにゅう,人の出すちち。母乳。
人尿,じんにょう,人間の尿。
人馬,じんば,１ 人と馬。２ 腰から上が人間、下が馬の架空の動物。
陣場,じんば,陣取っている場所。陣所。
塵肺,じんぱい,吸入した粉塵が肺に沈着することによって起こる病気。職業病の一つで、粉塵の種類によって珪肺(けいはい)・石綿肺・炭肺などがある。塵肺症。肺塵症。
人肥,じんぴ,人間の糞尿(ふんにょう)を肥料にしたもの。下肥(しもご)え。
靭皮,じんぴ,樹木の外皮のすぐ内側にある柔らかな部分。甘皮(あまかわ)。
人平,じんぴら,縦糸・横糸とも撚(よ)りのないレーヨン糸で織った平織りの布。
人品,じんぴん,人としての品格。特に、身なり・顔だち・態度などを通して感じられる、その人の品位。
塵風,じんぷう,ちりやほこりを吹き上げる風。ちりやほこりを含んだ風。
人物,じんぶつ,１ ひと。人間。２ 人柄。ひととなり。３ 人格・才能などのすぐれた人。人材。４ 描画の対象である人間の姿・形。
蕁麻,じんま,イラクサの漢名。
陣幕,じんまく,""
人面,じんめん,人間の顔。また、人間の顔に似たもの。にんめん。
人目,じんもく,１ 人の目。２ 人の見る目。ひとめ。
刃文,じんもん,日本刀で、焼き入れによって刀身に表れる刃(やいば)の形状。直刃(すぐは)・乱れ刃など。じんもん。
陣門,じんもん,陣営の門。軍門。
腎薬,じんやく,漢方で、滋養強壮・精力増進の薬。
陣容,じんよう,１ 軍隊の配置・編制のありさま。陣立て。２ 団体や組織などの、構成員の顔ぶれ。
人欲,じんよく,人間の欲望。
迅雷,じんらい,激しい雷鳴。
塵慮,じんりょ,俗世間の名利を欲する心。
人倫,じんりん,１ 人と人との間柄・秩序関係。君臣・父子・夫婦などの間の秩序。２ 人として守るべき道。人道。「人倫にもとる行為」
陣列,じんれつ,軍勢の配列。陣立て。
人和,じんわ,人々がなごやかな関係にあること。人の和。
時角,じかく,天球上で、天の両極を通る大円（時圏）が、天の子午線となす角。子午線を零時とし、角度を時間の単位に換算して、西回りに24時まで数える。15度で1時。
耳管,じかん,中耳の鼓室と咽頭腔(いんとうくう)とを結ぶ通気管。鼓室内の気圧を調節する。発見者の名から、エウスタキオ管・欧氏管ともいう。
磁器,じき,素地(きじ)のガラス質が磁化して半透明となり、吸水性のない硬質の焼き物。陶器より高火度で焼かれ、たたくと金属的な音がする。中国で創製され、日本では江戸初期の有田焼に始まる。
次数,じすう,単項式では、文字因数の個数。例えばx2y3において、xに関しては二次、yに関しては三次、xyに関しては五次となる。多項式では、含まれている単項式の最高次数をその式の次数とする。
十干,じっかん,甲(こう)・乙(おつ)・丙(へい)・丁(てい)・戊(ぼ)・己(き)・庚(こう)・辛(しん)・壬(じん)・癸(き)の総称。これに五行(ごぎょう)の木・火・土・金・水を結びつけ、さらにそれぞれ兄(え)（陽）と弟(と)（陰）を配し、甲(きのえ)・乙(きのと)・丙(ひのえ)・丁(ひのと)・戊(つちのえ)・己(つちのと)・庚(かのえ)・辛(かのと)・壬(みずのえ)・癸(みずのと)とよぶ。ふつう十二支と組み合わせて用い、年や日などを表す。
自閉,じへい,統合失調症の主症状の一。現実または外界から遠ざかり、対人交渉を極力避け、願望や苦悩を抱いたまま、自己の内界に閉じ込もる状態。
磁北,じほく,磁気コンパスが指す北の方角。一般に地球の実際上の北極を指す子午線の向きとは一致せず、その成す角を偏角という。真北の方向を得るためには偏角の補正をする必要がある。
麝香,じゃこう,香料の一。ジャコウジカの分泌物を乾燥したもの。漢方では興奮・強心・鎮痙(ちんけい)薬などに用いる。マスク。ムスク。四味臭。
重液,じゅうえき,純水より比重の大きい液。また、二つ以上の液の比重を比べたときに、その大きい方の液。鉱物や結晶粉末などの比重を測ったり、混合物を分離したりするのに用いる。四塩化炭素・ローバッハ溶液など。
重水,じゅうすい,重水素原子または重酸素原子を含む水。一般には重水素（ジュウテリウム）と酸素とからなる水をいい、原子炉の中性子減速材に用いられる。
儒教,じゅきょう,孔子が唱えた道徳・教理を体系化したもの。その学問内容を儒学という。儒教は、その国家教学としての規範性・体系性を強調した称。
熟年,じゅくねん,人生の中で、成熟した年代。1970年ごろにつくられた語で、はじめ老年の意、次いで中高年の意で用いられるようになった。
樹脂,じゅし,植物、特に針葉樹から分泌される混合物質。空気中で一部の成分が気化して固まる性質がある。松やになど。琥珀(こはく)はこれが化石化したもの。合成樹脂に対し、天然樹脂ともよぶ。
樹皮,じゅひ,樹木の表皮。最外層にある死んだ組織の集まりで、コルク形成層ができると外側に押し出され、内部と遮断されて、やがてはげ落ちる。
樹林,じゅりん,植物群系の一。木本植物が密に生えている群落。高木林・低木林に分けられる。高木層・低木層・草本層・コケ層など、多層構造をなす。熱帯降雨林・照葉樹林・針葉樹林など。
上院,じょういん,上下両院で構成される議会の一院。日本では、明治憲法下の貴族院、現在の参議院がこれにあたる。米国などの連邦国家では、各州の代表で組織。
上弦,じょうげん,新月から満月に至る間の半月(はんげつ)。太陽の90度東にあり、月の西半分が輝く。日没時に南中し、真夜中に弦を上にして沈む。
畳語,じょうご,同じ単語または語根を重ねて一語とした複合語。意味を強めたり、事物の複数を示したり、動作や作用の反復・継続などを表したりする。「我々」「泣き泣き」「またまた」「はやばや」「知らず知らず」などの類。
上寿,じょうじゅ,寿命が長いこと。また、寿命を上・中・下の三段階に分けた、最も上の段階。100歳、または120歳のこと。
腎炎,じんえん,腎臓の糸球体に炎症性病変が起こり、尿量減少・むくみ・血尿・たんぱく尿・高血圧などの症状を呈する病気。急性の場合は主に溶連菌の感染による。糸球体腎炎。腎臓炎。
腎臓,じんぞう,脊椎動物の泌尿器官。左右一対あり、暗赤色。ヒトではソラマメ形で、長さ約10センチ。内部は皮質と髄質とに区別できる。腎小体と尿細管とからなるネフロンにより血液からの尿の生成が行われる。
腎虫,じんちゅう,線虫綱腎虫科の寄生虫。体長約15～100センチで、鮮紅色。犬・豚・牛・馬のほか、まれに人の腎臓にも寄生する。中間宿主は淡水魚。
神頭,じんどう,的矢(まとや)の鏃(やじり)の一。鏑矢(かぶらや)に似て、先を平らに切り、的を傷つけないようにしたもの。長さ5～6センチで、多くは木製、黒漆塗り。磁頭。
図案,ずあん,１ ある物を製作するための下絵として、それを図にかきあらわすこと。デザイン。２ 装飾的に描かれた模様や柄。
随意,ずいい,束縛や制限を受けないこと。思いのままであること。また、そのさま。
随一,ずいいち,１ 同類中での第一番。２ さきがけ。最初のもの。
