name,reading,meaning,example
場合,ばあい,１ 物事が行われているときの状態・事情。局面。２ もし、ある事が起こったとき。そうなった折。３ …に関して。…について言えば。,260535
梅雨,ばいう,6月上旬から7月上・中旬にかけて、本州以南から朝鮮半島、揚子江流域に顕著に現れる季節的な雨。,2577
買価,ばいか,物を買うときの値段。買い値。,0
売価,ばいか,物を売るときの値段。売り値。,123
媒介,ばいかい,１ 両方の間にはいって仲立ちをすること。橋渡し。多く、病原菌をうつすこと。１ 他人の間に立って、他人を当事者とする法律行為の成立に尽力する事実行為。商行為の媒介を営業として行う者を仲立人という。１ ヘーゲルの用語。有限なものが単独では存在せず、他の有限なものとの関係において成立していること。また、個々のものをそのような関係において把握すること。,2350
売却,ばいきゃく,売りはらうこと。,8313
黴菌,ばいきん,人体に有害な細菌などの微生物の俗称。転じて、汚いものや厄介もののたとえ。,164
売国,ばいこく,私利などのために、敵国に通じて、自国の不利になることをすること。,89
媒材,ばいざい,１ 媒介となる材料。２ 絵の具をとく溶剤。,9
媒酌,ばいしゃく,結婚の仲立ちをすること。また、その人。。,198
買収,ばいしゅう,１ 買い取ること。買いおさえること。２ ひそかに利益を与えて、自分の有利になるように人を動かすこと。,9497
賠償,ばいしょう,１ 他の人に与えた損害をつぐなうこと。２ 国際法規違反により他国に与えた損害、また敗戦国が戦勝国に与えた損害の補償として金品その他を提供すること。,4775
陪審,ばいしん,法律の専門家でない人が、裁判の審理に参加し、有罪・無罪の判断を行うこと。,2238
煤塵,ばいじん,工場の煙突の煙や、鉱山・石切り場などの塵(ちり)の中に含まれている微粒子。,20
倍数,ばいすう,ある整数の何倍かの数。整数aが整数bで割りきれるとき、aはbの倍数であるという。⇔約数。,373
媒染,ばいせん,染料が直接に繊維に染着しないとき、繊維を媒染剤の溶液に浸して染料を固着させる染色法。,26
焙煎,ばいせん,１ コーヒー豆などを焙(ほう)じて煎(い)ること。２ 沖縄の泡盛。酒名は、原料の米を麹付けする前に焙煎にかける製法に由来。16年古酒。平成5年(1993)から1年間のみ販売。原料はタイ米、黒麹。アルコール度数30％。蔵元の「請福酒造」は昭和24年(1949)創業。,226
倍増,ばいぞう,2倍にふえること。2倍にふやすこと。倍まし。,892
媒体,ばいたい,１ なかだちをするもの。媒介するもの。２ 情報伝達の媒介手段となるもの。新聞・ラジオ・テレビなど。メディア。３ メモリーや磁気ディスクなど、データの記憶媒体のこと。,3730
売店,ばいてん,物を売る店。特に、病院・劇場・遊園地などの施設内の小さな店。,3137
買電,ばいでん,電力会社が、自家発電設備を持つ企業や太陽光発電設備を持つ家庭などから余った電力を買うこと。,11
売電,ばいでん,自家発電設備を持つ企業や太陽光発電設備を持つ一般家庭などが、余った電力を電力会社などに売ること。,80
梅肉,ばいにく,梅干しの種子を取り除いた果肉。すりつぶし、あえ物などに用いる。,46
売買,ばいばい,１ 売ることと、買うこと。売ったり買ったりすること。うりかい。２ 民法で、当事者の一方が財産権を相手方に移転することを約束し、相手方がこれに対して代金を支払うことを約束する契約。売買契約。,4534
売文,ばいぶん,文章を書き、それを売った報酬で生計を立てること。,116
売名,ばいめい,自分の名前を広く世間に知らせるようにすること。,175
売薬,ばいやく,１ あらかじめ製造・調合されて、市販されている薬。２ 薬を売ること。,296
培養,ばいよう,１ 草木を養い育てること。２ 動植物の胚や組織または微生物を人工的に生活・発育・増殖させること。３ 物事の根本を養い育てること。,2430
倍率,ばいりつ,１ ある数が他の数の何倍であるかを示す比率。また特に、競争率。２ 光学器械を通して目に見える大きさと、実物の大きさとの比。,1082
倍量,ばいりょう,ある量の、2倍の量。,62
馬鹿,ばか,１ 知能が劣り愚かなこと。また、その人や、そのさま。人をののしっていうときにも用いる。あほう。２ 社会的な常識にひどく欠けていること。また、その人。３ つまらないこと。無益なこと。また、そのさま。４ 度が過ぎること。程度が並はずれていること。また、そのさま。５ 用をなさないこと。機能が失われること。また、そのさま。,16193
場数,ばかず,経験した数。多くの経験。,231
麦雨,ばくう,麦が熟するころ降る雨。五月雨(さみだれ)。,3
爆音,ばくおん,１ 火薬などの爆発する際の音響。爆発音。２ 内燃機関で、混合気の爆発・排気の際に発する音。特に、飛行機・オートバイのエンジンの音。３ 俗に、非常に大きな音。,1902
爆撃,ばくげき,飛行機から爆弾などを投下して攻撃すること。,11442
爆砕,ばくさい,爆発物を用いて物を打ち砕くこと。,150
爆殺,ばくさつ,爆弾・爆薬を用いて人を殺すこと。,262
駁雑,ばくざつ,入りまじって純一でないこと。また、そのさま。,0
爆死,ばくし,爆弾・火薬・ガスなどの爆発によって死ぬこと。,358
麦酒,ばくしゅ,１ 麦を醸造した酒の総称。２ ビール。,528
爆傷,ばくしょう,爆弾やガスなどの爆発によって受けた傷。爆創。,17
爆笑,ばくしょう,大勢の人がどっと笑うこと。また、その笑い。,1590
爆心,ばくしん,爆撃・爆発の中心部。,450
驀進,ばくしん,まっしぐらに進むこと。,410
爆睡,ばくすい,起こそうとしても目が覚めないくらい深く眠ること。,57
瀑声,ばくせい,滝の音。,2
駁説,ばくせつ,他人の説を攻撃すること。また、その論説。駁論。,0
漠然,ばくぜん,ぼんやりとして、はっきりしないさま。広くてはてしのないさま。,268
莫大,ばくだい,程度や数量がきわめて大きいさま。,5521
爆弾,ばくだん,１ 爆薬を充塡(じゅうてん)し、投下または投擲(とうてき)して爆発させ、人や施設を殺傷・破壊するための兵器。２ 突然に周囲を大きく混乱させるもの、また重大な危険のたとえ。３ おでんの種にする、ゆで卵を芯にしたさつま揚げ。４ 第二次大戦後の混乱期に出まわった、粗悪な密造焼酎(しょうちゅう)。５ トウモロコシ・米などの穀粒を加熱・加圧してはじけさせた食品。爆弾あられ。,12444
博打,ばくち,１ 賽(さい)・花札・トランプなどを用い、金品をかけて勝負を争うこと。賭博(とばく)。ばくえき。２ 偶然の成功をねらってする危険な試み。,848
爆沈,ばくちん,艦船が爆発して沈没すること。また、敵艦船を爆弾などで沈没させること。,167
博徒,ばくと,ばくち打ち。,712
爆破,ばくは,爆発物を用いて破壊すること。,3710
漠漠,ばくばく,１ 広々として果てしないさま。２ ぼんやりとしているさま。とりとめのないさま。,2
爆発,ばくはつ,１ 物質が急激な化学変化または物理変化を起こし、体積が一瞬に著しく増大して、音や破壊作用を伴う現象。ガス・粉塵・火薬などの化学的爆発は発熱反応が激しく行われたことにより、ボイラー・火山などの物理的爆発は圧力の激しい発生・解放により起こる。また核分裂による核爆発がある。２ 抑圧されていた感情が急激に外に現れること。３ 星新一のショートショート作品。ひとにぎりの未来に収録。,24294
瀑布,ばくふ,高い所から白い布を垂らしたように、直下する水の流れ。滝。,603
爆風,ばくふう,爆弾などが爆発するときに起こる強い風。,1607
爆薬,ばくやく,火薬類のうち、物を破壊するための爆破薬、および爆弾・砲弾を炸裂(さくれつ)させるための炸薬のこと。,1879
爆雷,ばくらい,潜水艦攻撃用の爆弾。水中に投下または発射され、一定深度に達すると爆発する。,1179
爆裂,ばくれつ,爆発して破裂すること。,447
暴露,ばくろ,１ むき出しにすること。特に、悪事・秘密などをあばいて明るみに出すこと。また、それらが明るみに出ること。２ 風雨にさらすこと。また、さらされること。３ 細菌・ウイルスや薬品などにさらすこと。また、さらされること。,3326
駁論,ばくろん,相手の論を非難し、反対意見を述べること。また、その議論。,72
罵言,ばげん,ののしる言葉。手ひどい悪口。,123
馬車,ばしゃ,馬にひかせて、人や荷物を運ぶ車。,19581
場所,ばしょ,１ 何かが存在したり行われたりする所。ある広がりをもった土地。２ 人がいる所。また、物が占めるために要する広さ。３ 相撲の興行をする所。また、その期間。,118151
場末,ばすえ,繁華街の中心部から離れた場所。また、都心からはずれた所。,970
罵声,ばせい,口ぎたなくののしる声。,1288
抜去,ばっきょ,抜き去ること。,53
罰金,ばっきん,１ 罰として出させる金銭。２ 刑法の規定する主刑の一。犯罪の処罰として科せられる金銭。科料よりも重い財産刑。,2537
抜群,ばつぐん,１ 多くの中で、特にすぐれていること。ぬきんでていること。また、そのさま。２ 程度が大きいこと。また、そのさま。３ 程度がはなはだしいさま。,2511
抜剣,ばっけん,刀を鞘(さや)から抜くこと。また、その刀。抜刀。,114
跋語,ばつご,書物のあとがきとしてしるす言葉。跋文。跋。,2
伐採,ばっさい,山林などの樹木を切り出すこと。,2124
抜糸,ばっし,手術した切り口が癒着したあと、そこを縫い合わせていた糸を抜き取ること。,63
抜歯,ばっし,１ 治療のため、歯を抜くこと。２ 成人として認められるため、あるいは服喪などの目的で、口をあけると見える範囲の歯を抜く風習。日本では縄文時代後半から弥生時代前半に盛行。,143
抜粋,ばっすい,書物や作品からすぐれた部分や必要な部分を抜き出すこと。また、そのもの。,831
罰則,ばっそく,１ ある法令のなかで、違反行為に対する刑罰または過料を科する旨を定めている規定。２ 一般に、規則に違反した際に適用されるルール。ペナルティー。,1173
抜擢,ばってき,多くの人の中から特に選び出してある役目につけること。,4065
罰点,ばってん,１ 不良・誤り・消去などの意味を表す「×」の印。ばつ。２ 試合などで、反則・失敗などの回数を表す点数。,18
抜刀,ばっとう,刀を鞘(さや)から抜くこと。また、その刀。,1151
跋文,ばつぶん,本文とは別に、書物の終わりにしるす文章。あとがき。跋。,114
抜本,ばっぽん,根本的な原因を除き去ること。,807
抜毛,ばつもう,毛を抜くこと。特に、頭髪を引っ張って抜くこと。,32
罵倒,ばとう,激しい言葉でののしること。,1859
発条,ばね,鋼などの金属材料を螺旋(らせん)状に巻いたり折り曲げたりし、その弾力性を利用してエネルギーを吸収・蓄積するためのもの。,192
場面,ばめん,１ 変化する状況の、ある部分。物事が行われているその場のようす。２ 演劇・映画などの一情景。シーン。３ 市場の状況。場況。,19080
散銭,ばらせん,硬貨などの、こまかいぜに。小銭(こぜに)。ばら。,28
罵詈,ばり,口汚くののしること。また、その言葉。ののしり。,542
馬力,ばりき,１ 仕事率の単位。1馬力は、75キログラムの物を毎秒1メートル動かす力。仏馬力では735.5ワットで、日本では内燃機関などに限り使用が法的に認められ、記号PSを用いる。英馬力では746ワットで、記号HPを用いる。馬1頭当たりの工率に由来。２ 物事を精力的にこなす力。３ 荷物を積んで運ぶ馬車。荷馬車。,2314
挽歌,ばんか,１ 葬送のとき、柩(ひつぎ)を載せた車をひく人たちがうたう歌。また、人の死を悼んで作る詩歌。哀悼歌。２ 万葉集で、雑歌(ぞうか)・相聞(そうもん)とともに三大部立ての一。辞世や人の死に関するものなどを含む。古今集以後の哀傷歌にあたる。,269
晩夏,ばんか,１ 夏の終わり。夏の末。２ 陰暦6月の異称。,298
万化,ばんか,いろいろに変化すること。,0
挽回,ばんかい,失ったものを取り戻して、もとの状態にすること。回復。,893
番外,ばんがい,１ 予定された番数(ばんかず)・番組・順番などにないこと。２ 正規の委員や議員などではなくて、その席に列する者。オブザーバー。３ 普通のものとかけ離れて違っていること。また、そのもの。,1236
晩学,ばんがく,年をとってから学問に志すこと。,22
晩方,ばんがた,日の暮れるころ。暮れ方。夕方。,237
万巻,ばんかん,たくさんの書物。,161
万感,ばんかん,心にわき起こるさまざまの思い。,281
盤木,ばんぎ,造船時、船台上で船体を支えるために用いる大きな角材。木のほかコンクリート・鋼製のものもあり、積み重ねて支えを作る。,23
万客,ばんきゃく,多くの客。千客。ばんかく。,0
盤曲,ばんきょく,道などが、まがりくねること。,0
板金,ばんきん,１ 切り金の一。金を板のように薄く打ち延ばしたもの。２ 金属板や帯板を、常温のまま曲げたりしぼったりして加工すること。,390
万鈞,ばんきん,きわめて重いこと。非常に重みのあること。,3
番組,ばんぐみ,１ 演芸・映画・相撲などの演目・組み合わせや、その順序。また、それを書いたもの。プログラム。２ テレビ・ラジオなどの放送の、編成の単位となるもの。また、その部門。３ 番衆の組。,81011
番犬,ばんけん,家の番をする飼い犬。,858
万古,ばんこ,１ 遠い昔。また、遠い昔から現在まで。永遠。永久。千古。２ 三重県産の陶器。元文年間に桑名の豪商沼波弄山(ぬなみろうざん)が桑名の小向(おぶけ)で創業，更紗(さらさ)文様の赤絵など異色の製品を焼いた。製品に〈万古〉あるいは〈万古不易〉と捺印したため万古焼と呼ばれる。,111
蛮行,ばんこう,野蛮な行為。無教養で乱暴な行い。,290
番号,ばんごう,ものの順番を表す数字・符号。ナンバー。,23339
万国,ばんこく,１ あらゆる国。世界中の国々。万邦。２ 国際、世界の意。,844
蛮骨,ばんこつ,粗野で荒々しい気質。蛮カラ。,2
晩婚,ばんこん,普通より遅い年齢でする結婚。,164
晩歳,ばんさい,年老いた時。晩年。,0
万歳,ばんざい,１ 祝いや喜びの気持ちを込めてを唱えること。多く、威勢よく両手を上げる動作を伴う。また、その動作のこともいう。２ めでたいこと。うれしいこと。３ 降参すること。お手上げ。４ 野球で、野手がフライを捕球しようとして両手を上げながら、打球に頭上を抜かれること。５ めでたいときやうれしいときに、その気持ちを込めて発する語。,1272
万策,ばんさく,できるかぎりのあらゆる手段・方法。,193
晩餐,ばんさん,ごちそうの出る夕食。また、客を招いてもてなす夕食。ディナー。,2694
万死,ばんし,１ 生命の助かる見込みがないこと。また、命を投げ出すこと。２ 何度も死ぬこと。,87
万事,ばんじ,すべてのこと。あらゆること。,5392
晩酌,ばんしゃく,家庭で、夕食のとき酒を飲むこと。また、その酒。,507
磐石,ばんじゃく,１ 重く大きな石。いわお。２ 堅固でしっかりしていてびくともしないこと。,386
晩秋,ばんしゅう,１ 秋の終わり。秋の末。２ 陰暦9月の異称。,1281
晩春,ばんしゅん,１ 春の終わり。春の末。２ 陰暦3月の異称。,578
万障,ばんしょう,いろいろの不都合な事情。種々の故障や差し支え。,39
板状,ばんじょう,板のような形状。,606
盤上,ばんじょう,１ 盤の上。特に、碁盤や将棋盤などの上。２ 盤の上でする、碁・将棋・双六(すごろく)などの遊び。,495
万丈,ばんじょう,１ 非常に高いこと。また、非常に深いこと。２ きわめて意気が盛んなことのたとえ。,140
万状,ばんじょう,いろいろのありさま。さまざまの形。,0
伴食,ばんしょく,１ 主客の伴(とも)をして、ごちそうになること。相伴(しょうばん)。陪食(ばいしょく)。２ 実力や実権がなく、その職にあっても何もせず他の人のなすに任せていること。,21
晩節,ばんせつ,１ 人生の終わりのころ。晩年。２ 季節の終わり。３ 末の世。末年。４ 晩年における節操。,52
万全,ばんぜん,少しも手落ちのないこと。きわめて完全なこと。また、そのさま。,1488
伴奏,ばんそう,楽曲の主旋律や主声部を支え引き立てるために、他の楽器で補助的に演奏すること。また、その演奏。,3286
伴走,ばんそう,マラソンや自転車のロードレースなどで、競技者のそばについて走ること。,153
万態,ばんたい,いろいろの状態。さまざまの姿。,10
番台,ばんだい,銭湯などで、入り口に設けられた、入浴料を受け取ったり見張りをしたりするための高い台。また、そこに座っている人。,3160
万代,ばんだい,よろずよ。永遠。万世。,327
万端,ばんたん,ある事についてのあらゆる事柄・方法。,790
番地,ばんち,１ 居住地を明示するために、町村などの区域内を細分してつけた番号。２ コンピューターで、記憶装置内などに割り当てる識別番号。番地。インターネットで、メールアドレス、またはURLを意味する語として使われることもある。,3812
晩冬,ばんとう,１ 冬の終わり。２ 陰暦12月の異称。,49
番頭,ばんとう,１ 商家などの使用人のかしら。営業・経理など、店のすべてを預かる者。２ 警護すること。見張りをすること。また、その役。３ 風呂屋の番台に座る者。のち、風呂屋の下男や三助にもいった。,6552
万難,ばんなん,１ すべてに効力があること。２ あらゆることにすぐれていること。なんでもできること。,136
番人,ばんにん,番をする人。見張りをする人。,2116
万人,ばんにん,すべての人。多くの人。ばんじん。,19897
晩年,ばんねん,一生の終わりに近い時期。年老いてからの時期。,11173
万能,ばんのう,すべてに効力があること。,2037
万万,ばんばん,１ そうしたい気持ちは十分にあるが、そうできない事情があるさま。やまやま。２ 程度がはなはだしいさま。３ 十分に。よくよく。４ （あとに打消しの語を伴って）万が一にも。決して。,4
蛮風,ばんぷう,野蛮な風習。粗野な風俗。,29
万物,ばんぶつ,あらゆるもの。宇宙に存在するすべてのもの。,1460
万別,ばんべつ,さまざまであること。,0
万法,ばんぽう,１ あらゆる法則。すべての法律や規則。２ 仏語。物質的、精神的なすべての存在。また、それがもつ真理・法則。諸法。ばんぽう。,0
晩飯,ばんめし,晩の食事。夕食。夕めし。,812
盤面,ばんめん,１ 碁・将棋などの盤の表面。また、盤上の勝負の局面。２ レコードの盤の表面。,705
万来,ばんらい,多くの人が来ること。,0
万雷,ばんらい,多くのかみなり。また、大きくとどろく音のたとえ。,138
万里,ばんり,１ 一里の万倍。２ 非常に遠い道のり。非常に長い距離。,4184
馬医,ばい,１ 馬を診察・治療する獣医。うま医者。２ 律令制で、左右馬寮(めりょう)の官馬の世話などをした役。めい。うまくすし。,0
煤煙,ばいえん,１ 石油・石炭などの不完全燃焼で生じるすすや煙。大気汚染防止法では、硫黄酸化物・窒素酸化物・一酸化炭素や自動車の排気中の鉛化合物なども含める。２ 吉村昭の小説。死のある風景に収録。,643
倍音,ばいおん,上音の一。振動体の発する音のうち、基音の振動数の整数倍の振動数をもつ部分音。ハーモニックス。,459
貝貨,ばいか,貝殻製の貨幣。古代中国では、刀銭・布銭の流通前にコヤスガイが貨幣として用いられたと推定されている。また、西アフリカやオセアニアなどでは社会的関係や地位を象徴する宝物・贈答品として用いられている。,15
倍加,ばいか,１ 倍にふえること。また、倍にふやすこと。２ 増し加わること。また、増し加えること。,625
梅花,ばいか,１ 晩年の時期。２ ある時代・物事などの終わりの時期。末期。,438
倍角,ばいかく,１ 二倍にした角。２ 全角文字の縦幅または横幅を2倍にしたもの。また、その機能。かつてワードプロセッサーや初期のワープロソフトに備わっていた。,19
倍額,ばいがく,2倍の金額。2倍の価格。,140
売官,ばいかん,金銭・財物を納めさせ、その代償に官職を授けること。特に平安時代、国費の不足を補うために盛んに行われた。,38
唄器,ばいき,法会で、諷誦(ふじゅ)に用いる楽器。錫杖(しゃくじょう)・磬(けい)・鈴など。唄(ばい)。,0
貝器,ばいき,貝殻を加工して作った器具。日本では縄文時代の魚の鱗(うろこ)をはがす貝刃、弥生時代の穂摘み具など。,0
倍旧,ばいきゅう,以前よりも程度が増すこと。,5
梅月,ばいげつ,陰暦4月、または5月の異称。,41
唄師,ばいし,法会(ほうえ)で、唄(ばい)を唱える役の僧。,0
貝子,ばいし,タカラガイの別名。,31
梅子,ばいし,梅の果実。,830
媒質,ばいしつ,力や波動などの物理的作用を他へ伝える仲介物となるもの。音を伝える空気、光を伝える空間など。,292
倍尺,ばいしゃく,製図で、小形・複雑な物体を縮尺を拡大して描くこと。また、その倍率。拡大尺。,0
焙焼,ばいしょう,１ あぶり焼くこと。２ 金属の硫化物・砒化物(ひかぶつ)・アンチモン化物の形の鉱物を、融解しない程度の温度で焼き、硫黄・砒素などを酸化させたり気化させたりすること。金属精錬の予備処理として行われる。,22
陪食,ばいしょく,身分の高い人と一緒に食事をすること。,50
陪臣,ばいしん,１ 臣下の臣。またげらい。２ 江戸時代、大名の家臣の称。旗本・御家人を直参と称したのに対する語。,396
倍大,ばいだい,2倍の大きさ。,15
煤炭,ばいたん,石炭の旧称。,0
培地,ばいち,培養のために用いる、養分などを含む液状や固形の物質。,749
梅天,ばいてん,梅雨時の空。つゆぞら。,0
売品,ばいひん,売る品物。売り物。,27
陪賓,ばいひん,正客に相伴(しょうばん)をする客。陪客。,4
倍分,ばいぶん,分数・分数式の分母と分子に同じ数を掛けること。例えば、1/3の分母と分子にそれぞれ2を掛けて2/6としたり、3を掛けて3/9としたりするなど。,0
売卜,ばいぼく,報酬を得て、占いをすること。,107
貝母,ばいも,アミガサユリの別名。また、その鱗茎(りんけい)を乾燥させたもの。漢方で鎮咳(ちんがい)・去痰(きょたん)・排膿(はいのう)薬などに用いる。,19
売約,ばいやく,売る約束をすること。,27
梅林,ばいりん,梅の木の林。うめばやし。,369
梅霖,ばいりん,梅雨。さみだれ。つゆ。,0
場外,ばがい,商品先物取引で、取引所の外のこと。また、取引所外取引のこと。,1247
馬革,ばかく,馬のなめしがわ。,15
