name,reading,meaning,example
文楽,ぶんらく,人形浄瑠璃芝居の通称。,926
分利,ぶんり,高熱などが急に下がり、平熱に戻ること。,479
文理,ぶんり,１ 物事のすじめ。条理。２ 文章の筋道。文脈。３ 文科と理科。,411
文略,ぶんりゃく,文章や語句を省略すること。,18
分流,ぶんりゅう,１ 水や電気などの流れで、本流から分かれて流れること。また、分けて流すこと。また、その流れ。２ 中心となる系統から枝分かれした流派。分派。,894
文林,ぶんりん,１ 文学者の仲間。文苑。文壇。２ 詩歌・文章などを集めたもの。詩文集。文苑。３ リンゴの別名。４ 茶入れの一種。リンゴの形に似ている。,25
分路,ぶんろ,回路の中の二点を導線でつないで作った回路。分路。もとの回路を主路という。,0
文話,ぶんわ,文学や文章に関する話。,0
米価,べいか,米の値段。,496
米穀,べいこく,米。また、穀類の総称。,434
米作,べいさく,１ 米をつくること。稲の栽培と収穫。米づくり。２ 稲のみのりぐあい。,240
米産,べいさん,１ 米の生産。２ 米国で生産していること。,2
米収,べいしゅう,米の収穫。,0
米飯,べいはん,こめのめし。,345
冪乗,べきじょう,冪(べき)を作る算法。累乗。,120
別意,べつい,１ ほかの考え。他意。２ 別れを惜しむ心。,0
別異,べつい,１ 違っているところ。差異。２ 違いを区別すること。,0
別格,べっかく,定められている格式に拘束されないこと。特別の取り扱いをすること。,687
別巻,べっかん,全集で、本巻のほかに付け加えられた巻。,118
別館,べっかん,本館のほかに建てた建物。,978
別居,べっきょ,夫婦・家族などが別れて住むこと。,1519
別口,べつくち,１ ほかの方法や種類。２ 別の口座。,107
別掲,べっけい,別に掲げること。別に掲示・掲載すること。,10
別件,べっけん,別の事件。別の用件。,347
別個,べっこ,１ 別のものであること。また、そのさま。２ 一つ一つ切り離されていること。また、そのさま。個別。,2142
別戸,べっこ,別に一家を構えること。また、その家。,0
別号,べつごう,１ 別につけた称号・呼び名。２ 出家者が法名・道号のほかにつけた呼び名。,234
別冊,べっさつ,１ 雑誌・双書・全書などの付録として別にまとめられた本。２ 定期刊行物とは別に臨時に刊行されたもの。,956
別紙,べっし,１ 別の紙。ほかの紙。２ 書類などで、本書に添えた別の紙、または文書。,160
蔑視,べっし,相手をあなどって見くだすこと。,829
別室,べっしつ,１ 別のへや。ほかのへや。２ 特別に設けられた部屋。３ そばめ。めかけ。身分の高い人について使うことが多い。,1431
別種,べっしゅ,別の種類。ほかの種類。,1440
別書,べっしょ,別に書くこと。また、別に書いたもの。別の文書・書状。,0
別称,べっしょう,別の呼び名。別の名称。,1003
蔑称,べっしょう,相手や第三者、またはその動作や状態をさげすんでいう言い方。,553
別条,べつじょう,他と変わったこと。いつもとは違った事柄や状態。,241
別状,べつじょう,普通と変わった状態。異状。,362
別人,べつじん,別の人。その人とは違う人。,4820
別席,べっせき,１ 別に設けられた宴席や座敷。２ 席が別々であること。,35
別荘,べっそう,ふだん生活している家とは別に、避暑・避寒・休養などの目的で気候や風景のよい土地につくられた家。,8578
別宅,べったく,ふだん住んでいる家とは別に構えた家。別邸。,399
別段,べつだん,１ 特に異なること。特別・格別なこと。２ （あとに打消しの語を伴って用いる）特にとりたてて言うほどではないさま。とりわけ。,2113
別注,べっちゅう,量産品ではなく、特別に注文して作らせること。また、作らせた品。,12
別途,べっと,別の方法・用途。副詞的にも用いる。,1900
別納,ベつのう,１ ふつう一緒に納めるべきものを別に納めること。２ 中世、年貢を通常の手続きを取らずに直接、徴収また上納したこと。,34
別腹,べつばら,１ これ以上は食べられない満腹状態でも甘い菓子なら食べられることを、別の腹に入るといった語。２ 父が同じで母が違うこと。腹違い。異腹。,0
別便,べつびん,１ 別のたより。本便とは別に出す郵便物。２ 別に用いる輸送機関・輸送手段。,30
別嬪,べっぴん,美しい女性。美人。,330
別別,べつべつ,それぞれ違っていること。一緒ではないこと。また、そのさま。,22
別棟,べつむね,棟が別になっていること。また、その建物。,727
別名,べつめい,本名または正式の呼び方以外の名称。異名。べつみょう。,5385
別命,べつめい,特別の命令。別に出される命令。,361
別物,べつもの,１ 別の物。違った物。２ 普通ではない特別の物。例外。,1558
別離,べつり,１ わかれること。別れ。２ 若山牧水の第3歌集。明治43年（1910）刊行。歌壇で好評を博し、作者は注目の歌人となった。,959
別類,べつるい,別の種類。他の種類。,0
別枠,べつわく,定められたものとは別に設けられた範囲や基準。,219
便意,べんい,大小便、特に大便がしたい気持ち。,238
弁解,べんかい,言い訳をすること。言いひらき。,3622
勉学,べんがく,学問に励むこと。勉強。,1271
便器,べんき,大小便を受ける器。便所のものや、おまる・おかわなど。,1507
便宜,べんぎ,１ ある目的や必要なものにとって好都合なこと。便利がよいこと。２ 特別なはからい。そのときに適したやり方。３ 音信。たより。,3554
勉強,べんきょう,１ 学問や技芸を学ぶこと。学習。 ２ ある目的のための修業や経験をすること。 ３ 商品の値段を安くして売ること。４ 物事にはげむこと。努力すること。５ 気が進まないことをしかたなくすること。,20212
弁護,べんご,その人の利益になるように主張して助けること。また、その人に代わって事情をよく説明してかばうこと。,5989
便座,べんざ,洋式便器の腰かける部分。,243
弁座,べんざ,止め弁などで、流量調節のために上下する弁を受ける側の部分。,0
弁済,べんさい,１ 借りたものを相手に返すこと。２ 債務者または第三者が、債務の内容である給付を実現して債権を消滅させること。,680
便所,べんじょ,大小便をするために設けられた場所。雪隠(せっちん)。厠(かわや)。はばかり。,5223
弁償,べんしょう,人に与えた損害を、金銭または物品によって埋め合わせすること。,415
弁舌,べんぜつ,ものを言うこと。また、ものの言い方。話しぶり。,954
鞭撻,べんたつ,１ むちで打ってこらしめること。２ 努力するように励ますこと。,161
便通,べんつう,大便が出ること。,59
便秘,べんぴ,健康時に比べて排便の回数・量が著しく減り、便が滞る状態。ふんづまり。,482
便法,べんぽう,１ 物事をするのに便利な方法。２ 一時しのぎの便宜上の手段。,158
弁明,べんめい,１ 事情などを説明してはっきりさせること。２ 他人の非難などに対して、言い開きをすること。,1933
便覧,べんらん,物事の内容を知るのに便利で調べやすいように編集した本。多くは小型版。ハンドブック。びんらん。,148
便利,べんり,１ 目的を果たすのに都合のよいこと。あることをするのに重宝で、役に立つこと。また、そのさま。２ あることをする都合やぐあい。３ 大小便。通じ。,7016
弁論,べんろん,１ 大勢の前で、意見を述べること。２ 互いに論じ合うこと。また、その議論。３ 法律用語。民事訴訟法上、訴訟当事者の陳述。４ 法律用語。刑事訴訟法上、公判手続きのこと。特に、公判期日における訴訟関係人の陳述。,1334
米塩,べいえん,人間の生活に欠くことのできない米と塩。,43
米菓,べいか,米を主な材料として作った干菓子の総称。せんべい・あられなど。,71
米貨,べいか,米国の貨幣。,6
米軍,べいぐん,アメリカ合衆国の軍隊。陸軍・海軍・空軍・海兵隊・沿岸警備隊の五つの軍種からなり、複数の軍種を統合した九つの統合軍が編成されている。アメリカ軍。合衆国軍隊。,8057
米語,べいご,アメリカで使用されている英語。,33
米国,べいこく,アメリカ（亜米利加）合衆国の略称。,20459
米寿,べいじゅ,88歳のこと。また、その祝い。よねの祝い。,64
米州,べいしゅう,南北アメリカ大陸。,233
陪従,べいじゅう,１ 天皇・貴人に付き従って行くこと。また、その人。供人。供奉(ぐぶ)。ばいじゅう。２ 賀茂・石清水(いわしみず)・春日の祭りなどに、神前で行われる東遊(あずまあそび)の舞で、舞人に従って管弦や歌を演奏する地下(じげ)の楽人。ばいじゅう。,13
米商,べいしょう,米などの穀物を売買する職業。また、その人。米穀商。,45
米食,べいしょく,米を食べること。また、米を主食とすること。,79
米人,べいじん,米国人。アメリカ人。,256
米杉,べいすぎ,ヒノキ科の常緑高木。北アメリカ西海岸地方に産し、建築・土木用材として輸入。アメリカネズコ。,0
米銭,べいせん,こめと、ぜに。また、米代。,34
米点,べいてん,水墨山水画の技法の一。山や樹木などを水墨の横点を連ねて表すもの。中国、宋代の画家米芾(べいふつ)・米友仁父子に由来する。,0
米年,べいねん,88歳のこと。また、その祝い。よねの祝い。,0
米納,べいのう,租税を米穀で納めること。,8
米麦,べいばく,米と麦。また、穀物。,58
米粉,べいふん,米を粉にしたもの。こめのこ。,194
米松,べいまつ,アメリカマツの別名。,98
米綿,べいめん,米国産の綿花。,0
別院,べついん,１ 本山のほかに、本山に準じるものとして別の地域に設けられた寺院。２ 七堂伽藍(がらん)のほかに僧の住居として建てられた堂。３ 本寺のほかに別に建てられた本寺所属の支院。,501
別宴,べつえん,別れの酒盛り。送別の宴。,26
別科,べっか,本科のほかに設けた教育課程。,133
別火,べっか,神職などが日常用いる火による穢(けが)れを忌んで、神事・祭事に際して炊事の火を別にすること。また、服喪にある者などが穢れを他にうつさないように炊事の火を別にすること。べつび。,0
別学,べつがく,男女がそれぞれ別の学校、または別の教室で学ぶこと。男子を対象とする学校を男子校、女子を対象とする学校を女子校という。男女別学。,74
別記,べっき,本文のほかに、補足の説明などを別に書き添えること。また、その書き添えたもの。,108
別教,べっきょう,１ 天台宗で説く五時八教のうち、化法(けほう)の四教の第三。他の三教のいずれとも異なる別の教え。菩薩(ぼさつ)に対する教え。２ 華厳宗で、華厳経の教えが、三乗とは異なる究極真実の超絶的な一乗であるということ。,0
別業,べつぎょう,１ 別の職業・事業。２ 別荘。,80
別行,べつぎょう,１ 別の行。特に、文章中で行を改めて書くこと。２ 特別に執り行う仏事や修行。特別の行法。３ 大部の典籍のうち一部を独立させて流布させること。「法華経」普門品を独立させて観音経とする類。,0
別宮,べつぐう,本社または本宮に付属する神社。摂社・末社・今宮(いまみや)などの総称。,294
別郭,べつくるわ,日本の城で、他の郭と独立して一つずつ築いた郭。,9
別軍,べつぐん,本隊とは別に独立した軍隊。,0
別家,べっけ,１ 本家から分かれて別に家を興すこと。また、その家。分家。また、結婚して別に所帯をもつこと。２ 商家の奉公人が、主人からのれん分けを許されて、独立すること。また、その店。３ 本宅と別に設けた家。,339
瞥見,べっけん,ちらっと見ること。短い時間でざっと見ること。,225
別言,べつげん,言い方をかえて言うこと。また、その言葉。,72
別項,べっこう,別の条項。別の項目。,179
鼈甲,べっこう,１ 海ガメの一種タイマイの甲を加工して作った装飾品の材料。半透明で、黒と黄のまだらの模様がある。櫛(くし)・ブローチなどの細工物に用いる。江戸時代、タイマイの甲の使用が禁止されたことから、名をスッポン（鼈）に借りたものという。２ スッポンの背甲。漢方で強壮薬とする。,423
別才,べっさい,特別の才能。また、別の才能。,0
別辞,べつじ,別れの言葉。送別のあいさつ。,26
別時,べつじ,１ 別の時。ほかの時。また、遠い先の世。来世。２ 別れの時。離別の時。３ 念仏の行者が、特別の時日・期間を定めて称名念仏をすること。,0
別週,べつしゅう,別の週。ほかの週。,0
別宿,べっしゅく,宿を別にすること。別々に宿泊すること。また、その宿。,0
別製,べっせい,特に念を入れてつくること。また、そのもの。特製。,15
別選,べっせん,別に選ぶこと。特別に選ぶこと。,0
別送,べっそう,別途に送ること。,29
別足,べっそく,雉(きじ)の股(もも)などを焼いて足先を紙で包んだ料理。大饗(たいきょう)のときに正客に供した。,0
別体,べったい,１ 形体・様式を異にすること。２ 漢字で、標準字体に対して、その俗字・略字・古字などのこと。異体。,97
別月,べつづき,別の月。ほかの月。,0
別邸,べってい,ふだん住んでいる家とは別に構えた家。,1020
別伝,べつでん,１ 普通に伝えられているのとは別の言い伝え。２ 技芸・武芸・教義などにおける特別な伝授。３ 禅宗で、仏の悟りを伝えるのに、言葉や文字によらず、心から心へと直接伝えること。,84
別殿,べつでん,本殿とは別に建てた宮殿や社殿。,46
別電,べつでん,別の電報。,13
別派,べっぱ,別の宗派・流派・党派。,42
別売,べつばい,本体とは別料金で付属品を販売すること。また、組になっている商品を別々に売ること。,134
別日,べつび,別の日。ほかの日。,0
別表,べっぴょう,本文のほかに添える表。,609
別品,べっぴん,１ 特別によい品。２ 美しい女性。美人。,45
別府,べっぷ,大分県中部、別府湾に面する市。別府八湯を中心に発展した観光地。血の池地獄・海地獄などの地獄めぐりコースがある。,2053
別封,べっぷう,１ 別々に封をすること。また、別に封じたもの。２ 手紙の中に別に添えた封書。,49
別報,べっぽう,１ 別の知らせ。別の報道。２ 仏語。同じ人間に生まれたという共通の果報を総報というのに対し、貧富・貴賤・男女など個別的な差異として現れた果報。満果。,0
別法,べっぽう,別の方法。別のやり方。,10
別本,べっぽん,１ 同じ系統で、内容が多少異なっている別の本。２ 正本を写した控えの本。副本。,174
別間,べつま,別の部屋。ほかの室。別室。,112
別面,べつめん,別の紙面。ほかのページ。,0
別流,べつりゅう,別の流派や流儀。,19
別涙,べつるい,別れを悲しんで流す涙。,0
別路,べつろ,１ 別の道。ほかの道。２ 本道からはずれた道。わき道。,0
紅色,べにいろ,鮮やかな赤。くれない色。べに。こうしょく。,1265
紅絵,べにえ,１ 浮世絵版画で、墨摺(すみず)り絵に紅を主色として筆で彩色したもの。丹絵(たんえ)から発展した様式。２ 浮世絵版画で、墨版のほか紅・緑を主としたわずかな色数の色摺り木版画。江戸中期に始まり、のち錦絵(にしきえ)に発展した。紅絵(べにえ)ともよばれたが、今日では区別している。,41
紅貝,べにがい,ニッコウガイ科の二枚貝。浅海の砂地にすみ、殻長4センチくらい。貝殻は紅色、長卵形で後端は細長く伸びている。貝細工の材料。,36
紅蟹,べにがに,十脚目アサヒガニ科のカニ。甲が縦長で、甲長約20センチ。腹節が背面から見える。全身赤橙色。歩脚の平たい指節を使って後退しながら砂に潜る。相模湾以南から沖縄にかけて分布。食用。,0
紅鮭,べにざけ,サケ科の海水魚。全長約60センチ。体色は背側と各ひれが青黒色、腹側が銀白色。外洋を回遊し、秋、繁殖のため、上流に湖のある川を上る。このとき雌雄とも頭と尾びれのほかは鮮紅色の婚姻色を示す。北太平洋に広く分布。この陸封型がヒメマス。肉は紅色で美味。べにます。べに。,19
紅皿,べにざら,化粧用の紅を塗りつけてある小皿。指先や筆で溶いて用いる。皿紅。,18
紅雀,べにすずめ,スズメ目カエデチョウ科の鳥。全長約10センチ。雄は全体に赤紅色で白点が散在し、雌は黄褐色。雌雄ともくちばしが赤い。南アジアの草原に分布。飼い鳥とされる。,46
紅茸,べにたけ,ベニタケ科ベニタケ属のキノコの総称。茎が太くて短く、傘は浅い漏斗状に開き、赤色のものが多い。大部分が無毒で、食用にされるものもある。ドクベニタケ・アイタケなど。,16
紅鶴,べにづる,フラミンゴの別名。,23
紅鳩,べにばと,ハト科の鳥。全長23センチくらい。雄はぶどう色で頭と尾が灰色。雌は淡褐色。アジア南東部から南西部にかけて分布。,0
紅花,べにばな,キク科の越年草。高さ約1メートル。葉は堅くてぎざぎざがあり、互生する。夏、アザミに似た頭状花が咲き、鮮黄色から赤色に変わる。花を乾かしたものを紅花(こうか)といい婦人薬とし、また口紅や染料の紅を作り、種子からは食用油をとる。エジプトの原産で、日本では山形が主産地。すえつむはな。くれのあい。べにのはな。サフラワー。,334
紅檜,べにひ,ヒノキ科の常緑高木。材がヒノキより紅色となり、建築材に利用。台湾の原産。,0
紅鶸,べにひわ,アトリ科の鳥。全長13センチくらい。背面は褐色の縦斑があり、額が赤く、雄は胸も赤い。北半球北部で繁殖。日本では冬鳥。,0
紅筆,べにふで,口紅をつけるのに用いる筆。,25
紅鱒,べにます,ベニザケの別名。,3
部民,べみん,部(べ)に所属する民。べのたみ。ぶみん。,221
便益,べんえき,便宜と利益。都合がよく利益のあること。,190
鞭刑,べんけい,鞭(むち)で打つ刑。笞刑(ちけい)。,0
便室,べんしつ,１ 休息所。控室。２ 便所。厠(かわや)。,0
娩出,べんしゅつ,胎児を産み出すこと。,36
胼胝,べんち,繰り返し圧迫を受けた皮膚の部分が角質化し厚くなったもの。骨の出っぱったところにできやすい。ペンだこや座りだこ、肘(ひじ)だこなど。べんち。,77
鞭虫,べんちゅう,線虫綱鞭虫科に分類される袋形動物の総称。体は鞭(むち)状で、体長3～5センチ。人間のほか犬・羊などの盲腸に寄生する。,8
便殿,べんでん,貴人の休息のために設けた御殿。または、部屋。びんでん。,39
弁当,べんとう,１ 外出先で食べるために持っていく食べ物。２ 料理店などで出す、主食と副食を箱などに詰めたもの。３ 俗に、幼児などの口のまわりについた飯粒のこと。４ 俗に、執行猶予のこと。,8034
便腹,べんぷく,肥え太った腹。たいこ腹。,0
便服,べんぷく,ふだん着。平服。便衣。,4
便便,べんべん,１ 何もせずにいたずらに時を過ごすさま。２ だらだらとやたらに長いさま。３ 太って腹が出ているさま。太鼓腹であるさま。,3
便蒙,べんもう,初学者にわかりやすいように書いた書物。手引書。,5
母音,ぼいん,言語音の最小単位である単音の分類の一。呼気が口腔や咽頭での閉鎖や狭めをうけずに流れ出る音。,3309
拇印,ぼいん,親指の腹に墨や朱肉をつけて、印鑑の代わりに押すもの。法律上や取引上、印鑑のないときの代用にすることができる。,99
暴圧,ぼうあつ,力ずくで無理に押さえつけること。,69
暴威,ぼうい,荒々しい勢い。乱暴な威勢。,174
暴飲,ぼういん,酒を度を過ごして飲むこと。,115
謀印,ぼういん,にせの印をつくること。また、にせの印。,0
暴雨,ぼうう,激しく降る雨。,30
防衛,ぼうえい,他からの攻撃に対して、防ぎ守ること。,20469
貿易,ぼうえき,国際間の商品の取引。輸出と輸入の総称。互いに財貨を交換して取引を行うこと。交易。,14374
防疫,ぼうえき,感染症（伝染病）の発生・流行を予防すること。感染症患者の早期発見・隔離、消毒や媒介動物の駆除、予防接種などを行う。,366
望遠,ぼうえん,遠方のものを見ること。,604
忘恩,ぼうおん,恩を忘れること。恩知らず。,205
防音,ぼうおん,外部の音が室内に入るのを防ぎ、また室内の音が外に漏れるのを防ぐこと。,765
防火,ぼうか,火災の起こるのを防ぐこと。また、引火や延焼を防ぐこと。,1332
忘我,ぼうが,夢中になって、我を忘れること。心を奪われうっとりすること。,349
妨害,ぼうがい,邪魔をすること。,7122
望外,ぼうがい,望んでいた以上によい結果であること。また、そのさま。思いのほか。,230
傍観,ぼうかん,手を出さずに、ただそばで見ていること。その物事に関係のない立場で見ていること。,1629
暴漢,ぼうかん,乱暴をはたらく男。,518
防寒,ぼうかん,寒さをふせぐこと。,1069
謀議,ぼうぎ,１ はかりごとの相談をすること。２ 特に、犯罪の計画をめぐらし、その実行手段などについて相談すること。,497
忘却,ぼうきゃく,すっかり忘れてしまうこと。忘れ去ること。,1464
暴虐,ぼうぎゃく,むごいことをして人を苦しめること。また、そのさま。,651
謀逆,ぼうぎゃく,謀反(むほん)をたくらむこと。,5
防御,ぼうぎょ,敵の攻撃などを防ぎ守ること。,12060
望郷,ぼうきょう,故郷をなつかしく思いやること。懐郷。思郷。,411
防共,ぼうきょう,共産主義の侵入・拡大を防ぎとめること。,281
棒銀,ぼうぎん,将棋の居飛車戦法の一つで、銀の協力を得て飛車先から突破をねらう指し方。,60
防具,ぼうぐ,危険を防止するため身につける道具。特に、剣道・フェンシングなどの、面・胴・小手(こて)の類。剣道での正式名は剣道具。,1352
防空,ぼうくう,航空機やミサイルによる空中からの攻撃を防ぐこと。,3260
傍訓,ぼうくん,漢字のわきにつける読みがな。振りがな。ルビ。,16
暴君,ぼうくん,１ 人民を苦しめる暴虐な君主。２ ひとり横暴に振る舞う者。,1252
傍系,ぼうけい,１ 親族関係で、直系に対して、共同の始祖を通じてつながる系統。２ 直系から分かれ出た系統。３ 主流からはずれている系統のもの。,689
忘形,ぼうけい,１ 自己を超越して、無為自然の道を悟ること。２ 容姿・地位など形式的なものを問題にしないこと。隔てのないこと。,0
謀計,ぼうけい,はかりごと。相手をだます計略。謀略。,89
望月,ぼうげつ,陰暦十五夜の月。満月。もちづき。,2093
剖検,ぼうけん,解剖して調べること。病理解剖を行うこと。,86
望見,ぼうけん,遠くから眺め見ること。,404
冒険,ぼうけん,１ 危険を伴うことをあえてすること。２ 成功の見込みの少ないことを無理にすること。,12366
暴言,ぼうげん,礼を失した乱暴な言葉。無礼で、むちゃな発言。,744
謗言,ぼうげん,誹謗(ひぼう)する言葉。悪口。,0
防護,ぼうご,危害の及ぶのを防ぎ守ること。,2501
亡国,ぼうこく,１ 国をほろぼすこと。２ ほろびた国。また、国がほろびること。,390
