name,reading,meaning
地坪,じつぼ,地面の坪数。
実包,じっぽう,火薬が込めてある弾丸。実弾。
十方,じっぽう,１ 東・西・南・北の四方、北東・南東・南西・北西の四隅と上・下の方角。２ あらゆる方面。すべての所。
実米,じつまい,１ 現在ある米。現物の米。２ 取引市場で、実際に取引される米。実米。
実妹,じつまい,同じ父母から生まれた妹。
実夢,じつむ,事実とぴったり合う夢。正夢(まさゆめ)。
地艶,じつや,日本刀の地、すなわち鎬(しのぎ)から刃までの間を研磨したあとの仕上げぐあい。
実葉,じつよう,シダ植物の胞子葉(ほうしよう)のこと。
日来,じつらい,日ごろ。にちらい。
実利,じつり,実際の利益や効用。実益。
実理,じつり,日常生活の経験から得た道理。実際に即した理論。
耳底,じてい,耳の底。耳の奥。
自邸,じてい,自分の屋敷。
字典,じてん,漢和辞典や漢字字典など、語の表記単位である文字、特に漢字を登録した辞書。漢字を一定の順序に並べ、その発音・字源・意味・用法などを説明する。字書。字引(じびき)。もじてん。
自転,じてん,１ 自分で回転すること。２ 天体が、それ自身の内部にある軸の周りを回転する運動。
磁土,じど,磁器の原料となる良質の土や粘土。
侍読,じとう,天皇・東宮に仕え、学問を教授する学者。また、その職。後世は侍講という。じどく。
寺塔,じとう,寺の塔。寺院にある塔。
自党,じとう,自分の属する党派。
自盗,じとう,自らの金品を隠して、他人に盗まれたと届け出ること。
自得,じとく,１ 自分の力で悟ること。自分自身で理解し、会得すること。２ 自分自身で満足し、安んじること。また、得意になって、うぬぼれること。３ 自分の身に報いを受けること。
地床,じどこ,地面より低く作られた苗床。保温によい。
寺内,じない,寺の境内。寺院の中。山内(さんない)。
地内,じない,一定の区画をしてある土地の中。
地梨,じなし,クサボケの別名。
字謎,じなぞ,漢字を偏・旁(つくり)・冠・脚などに分けたりして示し、その漢字を当てさせるもの。
地縄,じなわ,建築工事を始めるとき、敷地に建物の位置を示すために張り巡らす縄。
自任,じにん,１ 自分で、そのことを自分の任務だと考えること。２ 自分の能力などが、それにふさわしいと思うこと。自負。
地貫,じぬき,柱の最下部に通した貫(ぬき)。
地鼠,じねずみ,トガリネズミ科の哺乳類。体長8センチ、尾長6センチくらいで、灰褐色。ネズミに似るが、吻(ふん)がとがる。ほぼ日本全域に分布し、森林・草地・畑などにすみ、昆虫・ミミズなどを食べる。夜行性。近縁種はヨーロッパ・アフリカ・アジアに分布。
地熱,じねつ,地下の岩石中に保有されている熱。主に放射性物質の崩壊によって発生する。
自然,じねん,１ おのずからそうであること。ひとりでにそうなること。２ 仏語。人為を離れて、法の本性としてそうなること。３ 少しも人為の加わらないこと。天然のままであること。
地蚤,じのみ,キボシマルトビムシの別名。ナス・ウリ・トマト畑に大発生することがある。
自派,じは,自分が属している派。
地場,じば,１ その地域や地方。そのことに直接関係する一定の区域。地元。２ 証券取引所（金融商品取引所）の所在地。３ 証券取引所（金融商品取引所）の所在地の周辺で営業している小規模の証券会社。また、それらの店に出入りする玄人客のこと。
児輩,じはい,子供たち。子供ら。
時輩,じはい,その当時の人々。その時の仲間。
自爆,じばく,１ 航空機・艦船・軍事施設などの機密を守り、敵の手に渡らないように爆薬を仕掛け味方の手で爆破すること。２ 爆薬を積んだ飛行機や自動車に乗って、また、自分の体に爆薬を巻き付けて敵陣に突っ込み爆発させること。テロの一手段。３ 俗に、社員が営業ノルマ達成のため、不要な自社製品などを買わされること。また、保険業界などで、社員が自分や家族などの名義で契約を結び、保険料を負担させられること。自爆。
自縛,じばく,１ 自分で自分を縛ること。２ 自分の主張した意見にとらわれて、思うままに振る舞えない状態に陥ること。
地機,じばた,織る人が足を前に出して地面や床に座って織る原始的な織機。縦糸の一端につけた帯を腰に当てて織る。
地蜂,じばち,クロスズメバチの別名。
地腹,じばら,子をはらんだりしていない、自然の状態の腹。常腹(じょうばら)。
児斑,じはん,乳幼児の臀部(でんぶ)・腰部などにみられる青色のあざ。その真皮中にメラニン色素細胞が存在することによる。黄色人種に特に顕著。7、8歳ごろまでに自然に消失する。小児斑。
自判,じはん,１ 自分で印判を押したり花押(かおう)を書いたりすること。また、その印や花押。２ 歌合わせなどで、自作の歌や自分が関係した歌の判をすること。３ 上級裁判所が原判決を取り消しまたは破棄したうえ、事件を原審に差し戻さずに、みずから判決をすること。
慈悲,じひ,１ 仏語。仏・菩薩(ぼさつ)が人々をあわれみ、楽しみを与え、苦しみを取り除くこと。２ いつくしみ、あわれむこと。なさけ。
字引,じびき,１ 漢和辞典や漢字字典など、語の表記単位である文字、特に漢字を登録した辞書。漢字を一定の順序に並べ、その発音・字源・意味・用法などを説明する。字書。もじてん。２ 国語辞典・対訳辞典など、語の言語としての意味・用法と内容を示す辞書。言語辞書。ことばてん。３ 多数の語を集録し、一定の順序に配列して一つの集合体として、個々の語の意味・用法、またはその示す内容について記したもの。語のほかに接辞や連語・諺なども収める。また、語の表記単位である文字、特に漢字を登録したものも含めていう。辞書は辞典（ことばてん）・事典（ことてん）・字典（もじてん）に分類されるが、現実に刊行されている辞書の書名では、これらが明確に使い分けられているとはいえない。辞典。字書。
次表,じひょう,次に掲げてある図や表。
耳標,じひょう,家畜の個体識別のために耳につける標識。
自評,じひょう,自分で自分の作品などを批評すること。
時評,じひょう,その時点での世間のいろいろな出来事について行う評論。
慈父,じふ,いつくしみ深い父親。また、父親を敬愛していう語。
二夫,じふ,二人の夫。にふ。
時風,じふう,その時代の風潮・風習。時流。
自服,じふく,茶席で、亭主が客に相伴して、自分で点(た)てた薄茶を自分で飲むこと。
時服,じふく,１ 四季の時候に合わせて着る衣服。時衣(じい)。２ 毎年春と秋または夏と冬の2季に、朝廷や将軍などから諸臣に賜った衣服。
地袋,じぶくろ,違い棚の下などに、地板に接して設けた小さい袋戸棚。
地太,じぶと,織地の糸の太いこと。また、太いもの。
寺兵,じへい,寺院が備えていた兵。僧兵。
時弊,じへい,その時代の悪習や弊害。
辞別,じべつ,別れの言葉を述べて去ること。いとまごい。
事変,じへん,１ 天変地異や突発的な騒動などの、非常の出来事。変事。２ 警察力では抑えきれず、軍隊の出動を必要とする程に拡大した騒乱。３ 宣戦布告なしに行われる国家間の戦闘行為。
時変,じへん,時代の変化。時代の移り変わり。
字母,じぼ,１ 仮名・アルファベット・梵字(ぼんじ)など、単語をつづる表音文字の一つ一つの字。２ 活字を鋳造するときに、活字の字面(じづら)の突出部を形成するために用いる金属製の雌型。製作法により、打ち込み母型・彫刻母型・電鋳母型の3種がある。字母。
慈母,じぼ,いつくしみ深い母親。また、母親を敬愛していう語。
寺宝,じほう,その寺に伝わる宝物。
次鋒,じほう,剣道や柔道などの5人制の団体戦で、2番目に戦う人。
時報,じほう,１ ラジオ・テレビ・電話などで、その時その時の正確な時刻を知らせること。また、それに用いる音。２ その時々の出来事を知らせること。また、その雑誌。
時法,じほう,1日の時間を同じ間隔に分けて、これに1時間ごとの名称をつけるきまり。
地細,じぼそ,織物の地の糸が細いこと。また、そのさま。
滋味,じみ,１ 栄養があって味のいいこと。栄養豊富でおいしい食べ物。２ 豊かで深い精神的な味わい。
自脈,じみゃく,自分の脈拍。また、自分で自分の脈をとって病状などを判断すること。
寺務,じむ,１ 寺の事務。寺院の運営に関する仕事。また、それを扱う僧。２ 寺の事務を総轄する職。じむしき。
時務,じむ,その時その時に応じた重要な仕事。その時の急務。
地虫,じむし,コガネムシ科の昆虫の幼虫の総称。体は乳白色または黄褐色の円筒形で、C字状に曲がる。頭は褐色。地中で植物の根などを食する。また、ケラなど地中にすむ昆虫をいうこともある。
地棟,じむね,棟木の下に、棟と平行に置く太い横木。
寺物,じもつ,寺に属する調度品や道具。
持物,じもつ,仏像が手に持っている物。その諸尊の性格・働きを示す標幟(ひょうじ)で、観世音菩薩の水瓶、薬師如来の薬壺、不動明王の剣など。じぶつ。
寺門,じもん,寺の門。また、寺。
耳門,じもん,１ 耳の穴の口。２ 一般には正門の横に設ける脇戸(わきど)や、扉や戸などの大きな建具の一部に組み込んだ、潜って通る小さな戸をさす。または、そうした戸をもつ出入口の総称。多くは通用口あるいは非常口として利用される。
自門,じもん,１ 自分の一族。一門。２ 自分の属する宗派、または寺。
時夜,じや,鶏が鳴いて、夜間の時刻を告げること。
砂籠,じゃかご,生け花で、「蛇籠1」に似せた竹や鋳物製の花留め。水盤に用いる。「蛇」の字を嫌って「砂」を当てたもの。
蛇籠,じゃかご,１ 竹または鉄線で粗く円筒形に編んだかごに石を詰めたもの。河川の水流制御や護岸などに用いる。石籠(せきろう)。じゃこ。２ 歌舞伎の「だんまり」などで、何人かの人物がそれぞれ前の人物の腰に右手を当て、引きとめる形で1列に並ぶ所作。
蛇蝎,じゃかつ,へびとさそり。人が恐れ嫌うもののたとえ。
蛇管,じゃかん,１ 表面積を大きくして吸熱・放熱作用の効果が上がるようにらせん状に作られた管。２ ホース。
邪鬼,じゃき,１ たたりをする神。また、物の怪(け)。怨霊(おんりょう)。２ 四天王像に踏まれている鬼。仏法を犯す邪神として懲らしめられ、苦悶の表情をみせる。
邪義,じゃぎ,誤った教義。正しくない見解。
邪曲,じゃきょく,心がひねくれて、すなおでないこと。不正・不道徳であること。また、そのさま。よこしま。
餌薬,じやく,養生のために用いる薬。薬餌(やくじ)。
弱音,じゃくおん,よわい音。小さい音。また、音をよわくすること。
弱子,じゃくし,年少の子供。おさなご。
弱志,じゃくし,意志が弱いこと。弱い意志。
寂寂,じゃくじゃく,１ ひっそりとして寂しいさま。２ 無心なさま。何も考えることのないさま。
若州,じゃくしゅう,若狭(わかさ)の異称。
弱卒,じゃくそつ,弱い兵士。頼りにならない部下。
弱敵,じゃくてき,弱い敵。弱い相手。
若道,じゃくどう,男が少年を愛すること。男色。にゃくどう。
弱毒,じゃくどく,毒性の弱いもの。また、弱めたもの。
弱拍,じゃくはく,音楽の拍で、強勢を受けない部分。二拍子の第2拍など。上拍。
雀斑,じゃくはん,そばかすのこと。
雀羅,じゃくら,スズメなどの小鳥を捕らえる網。とりあみ。
邪計,じゃけい,よこしまなはかりごと。悪だくみ。奸計(かんけい)。
邪見,じゃけん,１ よこしまな見方・考え方。不正な心。２ 仏語。因果の道理を無視する誤った考え方。五見・十惑の一。３ 相手の気持ちをくみ取ろうとせずに、意地悪くむごい扱いをすること。また、そのさま。
雑魚,じゃこ,１ いろいろな種類の入り交じった小魚。また、小さい魚。じゃこ。２ 地位の低い者、取るに足りない者をたとえていう語。小物。
蛇行,じゃこう,１ 蛇がはうように、くねくねと左右に曲がって行くこと。２ 河川が曲がりくねって流れること。メアンダー。曲流。
蛇苔,じゃごけ,ジャゴケ科のコケ植物。長さ約10センチ。表面に六角形の区画模様があり、蛇のうろこに似る。雌雄異株。
邪侈,じゃし,よこしまな心を持ち、おごりたかぶること。
邪宗,じゃしゅう,１ 人心を惑わす、有害な宗教。邪教。２ 江戸時代、キリシタン宗をさしていう。邪宗門。
邪術,じゃじゅつ,１ 不正な方法。また、幻術。魔法。２ 人類学などで、呪術の一分類。意図的に他人に災いを及ぼすためのまじない。
蛇心,じゃしん,蛇のように執念深くて陰険な心。
蛇身,じゃしん,蛇のからだ。蛇体。
蛇性,じゃせい,蛇の性質。蛇のような性質。
蛇体,じゃたい,蛇のからだ。蛇の姿・形。
蛇卵,じゃだま,チオシアン酸水銀を固めたもの。点火すると分解して容積を増し、炎と煙の中から褐色の灰が蛇のようにうねり出てくる。
惹起,じゃっき,事件・問題などをひきおこすこと。
惹句,じゃっく,人の心をひきつける短い文句。特に広告文などで、誇張してうたい上げた文句。キャッチフレーズ。
弱肩,じゃっけん,野球などで、球を投げる力が弱いこと。
弱行,じゃっこう,実行力が弱いこと。
弱国,じゃっこく,国力の弱い国。
蛇毒,じゃどく,ある種の蛇がもつ毒。
邪佞,じゃねい,不正な心をもちながら、人にへつらうこと。また、その人。
蛇腹,じゃばら,１ 組み立て式カメラや引き伸ばし機で、レンズと本体とをつなぐ、遮光性で折りたたみ式の伸縮自在の部分。２ 建物の軒や壁の最上部などに帯状に巡らした、刳形(くりかた)のある突出部分。胴蛇腹や軒蛇腹などがある。３ 衣服や帽子の装飾としてつける波状のテープ。４ アコーディオン・提灯(ちょうちん)などの胴体の、伸縮する部分。５ 縒(よ)りを強くかけた糸を2本合わせてさらに縒りをかけた糸。縫い紋の縁などに用いる。６ 革や布の合わせ目で、伏せ組みの代わりに蛇腹糸を伏せ縫いにした縫い方。蛇腹縫い。
邪飛,じゃひ,野球で、ファウルフライ。
蛇皮,じゃび,１ 蛇の表皮。２ 沖縄の三線(さんしん)の本土での俗称。室町末に本土に伝わり、改造されて三味線となる。
邪謀,じゃぼう,悪だくみ。奸計(かんけい)。
地山,じやま,盛土(もりど)・表土・堆積(たいせき)物に対し、それらに隠されている自然のままの地盤。
蛇虫,じゃむし,ゴカイ科の環形動物。体長約90センチになる大形のゴカイで、内湾の泥底中にすむ。東北・北海道に分布し、5、6月の生殖期にはいぼ足が大きく変形し、夜間に海面を生殖群泳する。
蛇紋,じゃもん,ヘビの胴体にある、まだらに似た模様。
砂利,じゃり,１ 小石。また、小石に砂のまじったもの。ざり。２ 子供。３ 江戸時代、奉行所の一区画で、町人・百姓などが着座する所。
邪恋,じゃれん,人としての道に外れた恋。
邪路,じゃろ,よこしまな道。邪道。
儒医,じゅい,儒者と医者を兼ねている人。
呪医,じゅい,呪術的方法で病気の診断や治療を行う者。
寿衣,じゅい,死者に着せる着物。経帷子(きょうかたびら)。
入院,じゅいん,１ 院と名のつくところにはいること。特に、病気やけがの治療などのために一定の期間病院にはいること。２ 僧侶が住職となって寺院にはいること。じゅいん。
従因,じゅういん,間接的な原因。
汁液,じゅうえき,植物などから自然にしみ出たり、しぼりとったりした液。しる。液汁。
獣疫,じゅうえき,獣類のかかる疫病。特に、家畜の伝染病。
重縁,じゅうえん,１ 親戚(しんせき)または婚姻の関係にある家と重ねて婚姻・縁組を行うこと。また、その相手の家。２ 深い因縁のあること。前世と現世の縁がかさなったもの。
重恩,じゅうおん,かさなる恩恵。厚い恩義。ちょうおん。
住家,じゅうか,すまい。すみか。住居。
重科,じゅうか,１ 重い罪科。重罪。２ 重い刑罰。重刑。
獣害,じゅうがい,イノシシやシカ、クマ、サル、ネズミなどの動物による被害。
縦隔,じゅうかく,胸腔内の中央にあり、左右の二つの肺を隔てている部分。前方に胸骨、後方に胸椎体があり、下方は横隔膜でふさがれる。
十月,じゅうがつ,一年の10番目の月。神無月(かみなづき・かんなづき)。
重患,じゅうかん,重い病気。重病。また、その患者。
銃眼,じゅうがん,敵を射撃したり監視したりするため、防壁・装甲板などにあけた穴。
重苦,じゅうく,重い苦しみ。耐えがたい苦しみ。
什具,じゅうぐ,日常使う道具や家具。什器。
戎具,じゅうぐ,軍事用の器具。兵器。戎器。
従軍,じゅうぐん,軍隊に所属または従属して戦地へ行くこと。
従兄,じゅうけい,年上の、男のいとこ。
重刑,じゅうけい,重い刑罰。重科。
銃刑,じゅうけい,銃殺にする刑罰。銃殺刑。
充血,じゅうけつ,体の一部で動脈末梢の血管が拡脹し、その部位に通常より多く血液の集まっている状態。赤く見え、温度も高い。
銃剣,じゅうけん,１ 銃と剣。また、武器の総称。２ 銃の先につける剣。ふだんは鞘(さや)に収め腰につけていて、突撃や接近戦のときに装着する。また、その剣をつけた小銃。
重言,じゅうげん,１ 同じ意味の語を重ねた言い方。「豌豆豆(えんどうまめ)」「半紙の紙」「馬から落馬する」など。じゅうごん。２ 同字を重ねた熟語。「堂堂」「隆隆」など。畳字(じょうじ)。畳語。
住戸,じゅうこ,マンションのような集合住宅の一戸一戸。
重合,じゅうごう,一種類またはそれ以上の単位物質の分子が、二つ以上化学的に結合して、もとのものより分子の大きい化合物をつくること。付加重合・共重合・縮重合など。
縦谷,じゅうこく,褶曲(しゅうきょく)山脈の走向と平行する谷。浸食に弱い地層の部分が浸食されて谷となったもの。
重刻,じゅうこく,既刊の書物を、同じ版で増刷すること。また、その本。
重根,じゅうこん,方程式の根のうちで、等しいものが二つ以上あるときの根。二つが等しい二重根、三つが等しい三重根など。
銃座,じゅうざ,射撃をするとき、銃を据える台。
重罪,じゅうざい,重い罪。重大な罪。重科。
重殺,じゅうさつ,野球で、ダブルプレー。併殺。
重三,じゅうさん,双六(すごろく)で、二つの賽(さい)の目がともに三と出ること。朱三。ちょうさん。
従姉,じゅうし,年上の、女のいとこ。
獣脂,じゅうし,獣類からとった脂肪。
縦恣,じゅうし,好きかってにふるまうこと。
重視,じゅうし,重要なものとして注目すること。
住持,じゅうじ,１ 一寺の主僧を務めること。また、その僧。住持職。住職。２ 仏の教えをかたく守ること。
十字,じゅうじ,１ 10個の文字。２ 十の字の形。十文字(じゅうもんじ)。３ キリスト教徒が、キリストが受難にあった十字架になぞらえて、祈祷(きとう)の際に手で描く十字の形。４ 十字形に並んで見える星座。北半球では白鳥座(はくちょうざ)、南半球では南十字座。５ 検地の用具。材木で、縦横ともに1尺2寸（約36センチ）くらいの十字形に切り組み、中央に水縄を入れるくぼみを刻んだもの。これを田の中央に張ってある水縄に当てて角度を測量する。６ 蒸し餅・まんじゅうの異称。
縦射,じゅうしゃ,前後に重なって並ぶ敵や、行軍隊形の敵を縦貫するように射撃すること。
銃手,じゅうしゅ,銃の撃ち手。射撃手。
柔術,じゅうじゅつ,徒手で打つ・突く・蹴る・投げる・組み伏せるなどの方法によって相手を攻撃し、また防御する日本古来の武術。やわら。
重唱,じゅうしょう,二つ以上の声部を、それぞれ一人ずつが担当して歌うこと。二重唱・四重唱など。連唱。
銃傷,じゅうしょう,銃弾で撃たれてできた傷。鉄砲傷。
縦条,じゅうじょう,動物の体表にある縞模様で、頭と尾を結ぶ軸と平行なもの。縦条。縦縞。
重職,じゅうしょく,責任の重い重要な職務。また、その職にある人。
従臣,じゅうしん,つきしたがう臣下。供の家来。
獣心,じゅうしん,けもののように、道理をわきまえない残忍な心。
縦陣,じゅうじん,艦隊などで、各艦を縦に一直線に並べた陣形。
十数,じゅうすう,単位を表す語の上に付いたり、助数詞を伴ったりして、それが10以上20未満であることを表す。
獣性,じゅうせい,１ 獣類のもつ性質。２ 人間のもつ、肉体的欲望などの動物的な性質。また、人間の凶暴・残忍な一面。「獣性をむき出しにする」
重星,じゅうせい,肉眼では1個に見えるが、望遠鏡では2個以上に見える恒星。2個の恒星からなる二重星が多い。相互に遠く離れていても方向が一致しているために接近して見えるものと、距離が近くて引力を及ぼし合っている連星とがある。
重石,じゅうせき,灰重石・マンガン重石・鉄マンガン重石・銅重石など、タングステン酸塩鉱物の総称。
重責,じゅうせき,重大な責任。
縦線,じゅうせん,１ たての線。たてせん。２ 楽譜で、小節を区切る垂直線。小節線。
十全,じゅうぜん,１ 少しも欠けたところがないこと。十分に整っていて、危なげのないこと。また、そのさま。万全。２ 概念または判断が、その表す対象と完全に相応すること。
住僧,じゅうそう,その寺に住んでいる僧。
重創,じゅうそう,重いきず。ふかで。重傷。
重奏,じゅうそう,二つ以上の声部を、それぞれ一人ずつが楽器で担当して演奏すること。二重奏・三重奏・四重奏など。アンサンブル。
重層,じゅうそう,幾重にも層になって重なること。
重曹,じゅうそう,炭酸水素ナトリウムのこと。
重葬,じゅうそう,すでに埋葬されている同一の場所に、重ねて埋葬すること。
従卒,じゅうそつ,将校に専属して、身の回りの世話などをする兵卒。将校当番兵。従兵。
従孫,じゅうそん,兄弟または姉妹の孫。
獣帯,じゅうたい,黄道を挟んで南北各8度ずつ、幅16度の帯。太陽、月、主な惑星はこの中を動く。黄道十二宮に相当する黄道十二星座があり、動物名の星座が多いため、獣帯とも呼ばれた。
縦帯,じゅうたい,動物の体表にある縞模様で、頭と尾を結ぶ軸と平行なもの。縦条。縦縞。
十代,じゅうだい,１ 10の世代。２ 10番目の代。３ 10歳から19歳までの年齢。10歳代。また、その年齢の人。ティーンエージャー。
