name,reading,meaning
明文,めいぶん,１ はっきりと規定されてある条文。２ わかりやすく筋の通った文章。
名簿,めいぼ,ある組織・団体などに属する人の氏名や住所を書き連ねた帳簿。
名峰,めいほう,姿の美しい山。名高い山。名山。
銘木,めいぼく,形状・色沢・木理・材質などに趣があるために珍重される木材。
命名,めいめい,名前をつけること。
銘銘,めいめい,ひとりひとり。それぞれ。おのおの。
明滅,めいめつ,あかりがついたり消えたりすること。光が明るくなったり暗くなったりすること。
名目,めいもく,１ 名称。呼称。特に、表向きの名称。みょうもく。２ 表向きの理由。口実。みょうもく。
瞑目,めいもく,１ 目を閉じること。目をつぶること。２ 安らかに死ぬこと。
名門,めいもん,由緒のある家柄。名家。また、有名な学校・団体など。
盟約,めいやく,かたく誓って約束すること。また、その約束。
名優,めいゆう,演技のすぐれた俳優。名高い俳優。
盟友,めいゆう,かたい約束を結んだ友。同志。
名誉,めいよ,１ 能力や行為について、すぐれた評価を得ていること。また、そのさま。２ 社会的に認められている、その個人または集団の人格的価値。体面。面目。３ 身分や職名を表す語に付けて、その人の功労をたたえて贈る称号とするもの。４ 有名であること。評判が高いこと。また、そのさま。よいことにも悪いことにもいう。５ 珍しいこと。また、そのさま。不思議。６ どういうわけか。不思議に。
明瞭,めいりょう,はっきりしていること。また、そのさま。明亮(めいりょう)。
命令,めいれい,１ 上位の者が下位の者に対して、あることを行うように言いつけること。また、その内容。２ 国の行政機関が制定する法の形式、および、その法の総称。法律を実施するため、または法律の委任によって制定される。政令・総理府令・省令など。３ 行政庁が特定の人に対して一定の義務を課する具体的な処分。４ 訴訟法上、裁判官がその権限に属する事項について行う裁判。５ コンピューターで、コマンドのこと。
迷路,めいろ,１ 迷いやすい道。入り込むと迷って出られなくなるような道。２ 1を図形化した遊び。３ 内耳の骨迷路とその中にある膜迷路のこと。
明朗,めいろう,１ こだわりがなく、明るくほがらかなこと。また、そのさま。２ 内容をはっきりと示して、うそやごまかしがないこと。また、そのさま。
迷惑,めいわく,１ 人のしたことで不快になったり困ったりする・こと（さま）。２ どうしてよいか迷うこと。３ 困ること。
目上,めうえ,階級・地位や年齢が自分より上であること。また、その人。⇔目下(めした)。
夫婦,めおと,夫と妻。ふうふ。みょうと。
目頭,めがしら,目の、鼻に近い方の端。⇔目尻。
目方,めかた,物の重さ。はかりで量った重さ。重量。
女神,めがみ,１ 女性の神。２ 星新一のショートショート作品。妄想銀行に収録。
盲判,めくらばん,文書の中身を検討もしないで承認の印を押すこと。また、その判。
目先,めさき,１ すぐ目の前。眼前。２ 目の前にある物事。その時その場。当座。３ ごく近い将来を見通すこと。また、先の見通し。
目地,めじ,石・煉瓦・コンクリートブロックなどの組み積みやタイルなどの貼り付けの際に、部材の接合部にできる継ぎ目。
目下,めした,地位・年齢などが自分より下であること。また、その人。
飯代,めしだい,飯の代金。また、食費。食事代。
飯屋,めしや,大衆向きの簡単な食事をさせる店。
目尻,めじり,目の耳側の方の端。まなじり。
目印,めじるし,１ 見てすぐわかるようにつけたしるし。２ 目標となる物。３ 江戸時代、商標をいった語。
目線,めせん,１ 視線のこと。２ その立場における、ものの考え方やとらえ方。３ 写真の中の人物を特定しにくくするために、目の部分を覆い隠すように加工した、帯状の線やぼかし。
滅却,めっきゃく,ほろびること。すっかりなくなること。また、ほろぼすこと。すっかりなくすこと。
滅菌,めっきん,熱・薬品・放射線などで細菌を死滅させること。殺菌。
滅期,めつご,入滅の時期。臨終の時。
滅私,めっし,私心をなくすこと。私利私欲を捨て去ること。
滅多,めった,１ 思慮の浅いさま。軽率であるさま。２ ごく当たり前であるさま。並大抵。３ 度を越しているさま。むやみ。４ （多く「めったに」の形で、あとに打消しの語を伴って）まれにしかしないさま。まれにしか起こらないさま。
滅茶,めっちゃ,程度がはなはだしいさま。非常に。たいへん。
滅亡,めつぼう,ほろびること。絶えてなくなってしまうこと。
滅裂,めつれつ,ばらばらになって形を失うこと。統一性がないこと。また、そのさま。
目処,めど,目指すところ。目当て。また、物事の見通し。
目端,めはし,その場を見はからう機転。
目星,めぼし,１ 目当て。見当。見込み。２ 目の角膜の縁に、粟粒ほどの小さな白い濁りのできたもの。星目。３ 疲れたときや頭を打ったときなどに目にちらつく星のようなもの。
目安,めやす,１ 目当て。目標。おおよその基準。また、おおよその見当。２ そろばんの掛け算や割り算で、そろばん上の左のほうに置く乗数または除数。３ そろばんで、五玉(ごだま)と小玉(こだま)との仕切りの梁(はり)に記してある位取りの文字や印。４ 箇条書きにした文書。中世では、箇条を立てて書いた訴状と陳状。江戸時代ではもっぱら訴状のことをいう。目安書き。目安状。
免疫,めんえき,１ 病原体や毒素、外来の異物、自己の体内に生じた不要成分を非自己と識別して排除しようとする生体防御機構の一。本来は、ある特定の病原体に一度感染して回復できると抵抗性をもつようになり、同じ病気にかからなくなることをいう。先天的に備わる自然免疫と、後天的に得られる獲得免疫がある。機構としては細胞性免疫と液性免疫の二つが働く。２ 物事が度重なってそれに慣れてしまうこと。
免役,めんえき,１ 服役を免除すること。２ 兵役を免除すること。３ 服役囚の就役を免除すること。
面会,めんかい,人と会うこと。対面。
免許,めんきょ,１ ある特定の事を行うのを官公庁が許すこと。また、法令によって、一般には禁止されている行為を、特定の場合、特定の人だけに許す行政処分。２ 師から弟子にその道の奥義を伝授すること。また、その証書。ゆるし。
綿糸,めんし,綿花を原料とした糸。
面識,めんしき,互いに顔を知っていること。知り合いであること。
免除,めんじょ,１ 義務・役目などを免じること。２ 民法上、債権者が債務者に対する意思表示によって債務を消滅させること。債務免除。
免状,めんじょう,１ 免許の証として授与する文書。免許状。２ 卒業証書のこと。３ 江戸時代、その年の上納すべき年貢高を記して、領主から村方へ交付した文書。年貢割付状。４ 赦免状のこと。
免税,めんぜい,税を免除すること。課税しないこと。免租。
免責,めんせき,１ 責任を免じること。責任を問われるのを免れること。２ 債務者が債務を免れること。
面積,めんせき,ある場所の広さ。線で囲まれる平面や曲面の広さ。単位は平方メートル、アールなど。
面接,めんせつ,直接に会うこと。特に、応募者や対象者に直接会って試問・助言などをすること。
面前,めんぜん,目の前。見ている前。
面相,めんそう,１ 顔のありさま。顔つき。２ 日本画用の絵筆の一。眉毛(まゆげ)や鼻の輪郭など細い線を描くのに用いる、穂先のきわめて細長いもの。
眠蔵,めんぞう,禅宗で、寝室・納戸(なんど)の類をいう。眠堂(めんどう)。
面談,めんだん,面会して直接話をすること。
面倒,めんどう,１ 手間がかかったり、解決が容易でなかったりして、わずらわしいこと。また、そのさま。２ 世話。３ 体裁がわるいこと。見苦しいこと。また、そのさま。
面目,めんぼく,１ 世間や周囲に対する体面・立場・名誉。また、世間からの評価。めんもく。２ 物事のありさま。ようす。めんもく。
綿密,めんみつ,１ 途絶えることなく続くさま。２ ことこまかなさま。
面面,めんめ,反射代名詞。自分。自分自身。
綿綿,めんめん,長く続いて絶えないさま。
面面,めんめん,１ おのおの。一人一人。各自。めいめい。２ 二人称の人代名詞。対等または目下の多数の者に呼びかけるのに用いる。
面容,めんよう,顔かたち。顔つき。面貌(めんぼう)。
目垢,めあか,目から出る粘液の固まったもの。めあか。めくそ。
目赤,めあか,ウサギの別名。
雌麻,めあさ,麻の雌株。
迷案,めいあん,いい案に見えて、実行できるはずのない案。
名医,めいい,すぐれた医者。有名な医者。
名園,めいえん,すぐれた庭園。名高い庭園。
名演,めいえん,すぐれた演技や演奏。
名王,めいおう,すぐれた王。名高い君主。
明王,めいおう,すぐれた、かしこい王。明君。
名家,めいか,１ 名望のある家柄。名門。２ 公卿の家格の一。文筆を主とし、弁官を経て、蔵人(くろうど)を兼ね、大納言まで昇進できる家柄。羽林家(うりんけ)の下、諸大夫家(しょだいぶけ)の上に位する。日野・広橋・烏丸・葉室・勧修寺・万里小路(までのこうじ)などの諸家の称。３ その道にすぐれた人。名声の高い人。名人。
名歌,めいか,名高い歌。すぐれた詩歌。
名花,めいか,１ 美しい花。名高い花。２ 美女、また、名高い芸妓などのたとえ。
明学,めいがく,東京都港区に本部のある私立大学。明治10年（1877）いくつかの神学塾を統一して設立された東京一致神学校に始まり、明治学院専門学校を経て、昭和24年（1949）新制大学として発足。
明鑑,めいかん,１ 曇りがない鏡。明鏡。転じて、ものの姿をあきらかにうつしだすもの。２ あきらかな鑑定。
銘肝,めいかん,心に刻みつけて忘れないこと。銘記。
鳴管,めいかん,鳥類の発音器官。気管の変形したもので、多くは気管が2本の気管支に分かれる所にひだ状の薄い膜があり、呼気で振動し共鳴させて鳴き声を出す。
名器,めいき,すぐれた器物。名作とされる器物。
銘旗,めいき,葬式で用いる、死者の姓名・官位などを記した旗。銘旌(めいせい)。
銘記,めいき,心に深く刻みつけて忘れないこと。銘肝。
名妓,めいぎ,名高い芸妓。歌舞などにすぐれた芸者。
名技,めいぎ,すぐれたわざ・演技。
命宮,めいきゅう,人相判断で、両眉の間のこと。
名教,めいきょう,人のふみ行うべき道を明らかにする教え。また、儒教の教え。
明鏡,めいきょう,曇りのない、よく映る鏡。
迷曲,めいきょく,有名な曲に似せたり、また、あれこれのメロディーを組み合わせたりした、訳が分からないがそれなりに面白い楽曲。
名玉,めいぎょく,１ すぐれた宝玉。名高い玉。２ 俗に、優れたカメラレンズのこと。
鳴禽,めいきん,１ よくさえずる鳥。よい声で鳴く鳥。２ 鳴禽類の鳥。
名句,めいく,１ すぐれた句。有名な句。連歌・俳諧や漢詩などにいう。２ すぐれた文句。有名な文句。３ 当を得た、気のきいた文句。
名君,めいくん,すぐれた君主。名高い君主。
明君,めいくん,賢明な君主。明主。
盟兄,めいけい,友人を敬っていう語。
明決,めいけつ,はっきりした決断。明断。
名月,めいげつ,陰暦八月十五夜の月（中秋の名月）。また、陰暦九月十三夜の月（栗(くり)名月）。
明月,めいげつ,曇りなく澄みわたった満月。また、名月。
名剣,めいけん,すぐれた刀剣。名高い刀剣。
鳴弦,めいげん,邪気を払うために、弓の弦を手で引き鳴らすこと。また、その人。天皇の入浴のときや貴人の誕生・病気の際などに広く行われた。つるうち。ゆみづるうち。
謎語,めいご,なぞを含んだ言葉。また、意味のあいまいな語。
命期,めいご,生きながらえている期間。寿命。
姪御,めいご,他人の姪を敬っていう語。
名香,めいこう,かおりがよく、名高い香。
名号,めいごう,１ となえる名。名称。また、名声。２ 仏・菩薩(ぼさつ)の名。これを聞いたり唱えたりすることに功徳(くどく)があるとされる。特に、「阿弥陀仏」の4字、「南無阿弥陀仏」の6字をさす。
命根,めいこん,いのちのもと。息の根。また、いのち。みょうこん。
迷魂,めいこん,浮かばれずに迷っている霊魂。
迷作,めいさく,優れているとは言えないが駄作でもない、ねらいのはっきりしない妙な作品。
名刹,めいさつ,名高い寺。
名山,めいざん,形がすぐれている、歴史があるなどで名高い山。
名辞,めいじ,論理学で、概念を言語で表したもの。実際上、概念と同じ意味に用いられる。
名主,めいしゅ,すぐれた君主。名君。
名酒,めいしゅ,名の知られた味のよい酒。
明主,めいしゅ,賢明な君主。明君。
明珠,めいしゅ,透明で曇りのない玉。また、すぐれた人物、貴重な人物のたとえ。
盟主,めいしゅ,同盟の主宰者。仲間のうちで中心となる人物や国。
銘酒,めいしゅ,銘のある上等の酒。
名将,めいしょう,すぐれた武将。名高い大将。
名証,めいしょう,愛知県名古屋市中区栄にある証券取引所（金融商品取引所）。昭和24年（1949）開設。略称は、名証(めいしょう)。
名相,めいしょう,すぐれた大臣。名高い宰相。
明証,めいしょう,１ はっきり証明すること。また、はっきりした証拠。２ 哲学で、いかなる人もその真理性を絶対に疑いえないような認識のもつ直接的確実性。直証。
名城,めいじょう,りっぱな城。名高い城。
明色,めいしょく,あかるい色。明度の高い色。
名臣,めいしん,すぐれた臣下。賢臣。
名神,めいしん,名古屋と神戸。
名数,めいすう,１ 同類のものをいくつかまとめ、一定の数をつけて呼ぶもの。「三筆」「四天王」「七福神」など。２ 単位の名称や助数詞をつけた数。「一個」「二軒」「三人」「五本」の類。
命数,めいすう,１ 命の長さ。天命。寿命。２ 天から授けられた運命。宿命。３ 数学で、ある数に名称を与えること。
名石,めいせき,由緒のある石。
名籍,めいせき,名簿。特に、官位・姓名・年齢などを書きしるしたもの。
名跡,めいせき,１ 名高い古跡。２ 代々受け継がれていく家名。また、それを受け継ぐこと。
名節,めいせつ,名誉と節操。ほまれと、みさお。
名説,めいせつ,すぐれた説。有名な説。
迷説,めいせつ,見当違いな説。訳の分からない説。
名川,めいせん,水質・景観がよい、歴史的に名高い、などのすぐれた特徴をもつ川。名水。
銘仙,めいせん,玉糸・紡績絹糸などで織った絹織物。縞柄・絣(かすり)柄などがあり、着尺(きじゃく)・夜具地などに用いられた。秩父(ちちぶ)・伊勢崎・足利(あしかが)などが産地。
名草,めいそう,花が美しい、薬効がある、などのためによく知られている草。
明窓,めいそう,光のよくさし込む明るい窓。
名族,めいぞく,名のある家柄。名門。
目板,めいた,板塀や羽目板の合わせ目に打ち付ける幅の狭い板。
名大,めいだい,名古屋大学の俗称。
明大,めいだい,東京都千代田区に本部のある私立大学。明治14年（1881）設立の明治法律学校に始まり、大正9年（1920）旧制大学となり、昭和24年（1949）工業・農業などの各専門学校を統合して新制大学へ移行。
明断,めいだん,明快に判断すること。また、その判断。
明智,めいち,すぐれた知恵。
銘茶,めいちゃ,特別に名のある上質の茶。
螟虫,めいちゅう,メイガ、特にニカメイガの幼虫。ずいむし。
名著,めいちょ,すぐれた著作。有名な著書。
迷著,めいちょ,見当違いで、何を書きたいのか分からない著作。
名帳,めいちょう,氏名を記す帳簿。名簿。
明澄,めいちょう,曇りなくすみきっていること。また、そのさま。
明徴,めいちょう,明らかな証拠。また、証拠などに照らして明らかにすること。
迷鳥,めいちょう,本来はその地域に生息も渡来もしない鳥で、渡りのコースから外れたり、台風で飛ばされたりして迷い込んで現れるもの。
名店,めいてん,名高い店。有名店。
明度,めいど,彩度・色相とともに、色の三属性の一。色の明るさの度合い。
名刀,めいとう,すぐれた刀。世に名高い刀。
名東,めいとう,名古屋市の区名。千種区の東に位置し、住宅地。牧野ヶ池緑地がある。
迷答,めいとう,とんでもない答え。わけのわからない答え。
銘刀,めいとう,刀工の名を刻した刀。銘の打ってある刀。
明道,めいどう,程顥(ていこう)の号。
名徳,めいとく,名声があり徳が高いこと。また、その人。多く、僧侶についていう。
明徳,めいとく,１ 正しく公明な徳。２ 天から与えられたすぐれた徳性。
名馬,めいば,すぐれた馬。名高い馬。
名盤,めいばん,すぐれた演奏の録音盤。有名なレコード盤。
名筆,めいひつ,書画や文章にすぐれていること。また、その人やその作品。
冥府,めいふ,死後の世界。冥土。特に、地獄。閻魔(えんま)の庁。
名分,めいぶん,１ 立場・身分に応じて守らなければならない道義上の分限。２ 事をするについての表向きの理由。名目。
名文,めいぶん,すぐれた文章。有名な文章。
名聞,めいぶん,世間での評判や名声。みょうもん。
迷文,めいぶん,見当違いだが、面白いところもある文。
銘文,めいぶん,銘として、金石・器物・像などに刻まれた文字・文章。金石文。めいもん。
名宝,めいほう,りっぱな宝物。名高い宝。
明法,めいほう,１ 法を正し明らかにすること。２ 中国唐代の官吏登用試験の科目の一。法律を主としたもの。
明鮑,めいほう,アワビの肉を煮てから干した食品。中国料理の材料。
盟邦,めいほう,同盟を結んだ国。同盟国。
名望,めいぼう,名声と人望。
明眸,めいぼう,澄んだ美しいひとみ。美人のたとえにいう。
名木,めいぼく,１ りっぱな樹木。由緒のある名高い樹木。２ すぐれた香木。多く伽羅(きゃら)をいう。
命脈,めいみゃく,いのち。生命。生命のつながり。
迷夢,めいむ,迷いの境地を夢にたとえた語。
迷霧,めいむ,１ 方角のわからないほどの深い霧。２ 迷いの境地を霧にたとえた語。
迷妄,めいもう,道理がわからず、事実でないことを事実だと思い込むこと。
名薬,めいやく,よくきくという評判の薬。名高い薬。
名訳,めいやく,すぐれた翻訳や解釈。
迷訳,めいやく,間違いではないが、見当のずれている訳文。
明喩,めいゆ,比喩法の一。「ようだ」「ごとし」「似たり」などの語を用いて、二つの事物を直接に比較して示すもの。「雪のような肌」「蜜に群がる蟻(あり)のごとく集まる」の類。
迷優,めいゆう,上手のような下手のような、奇妙な演技を見せる俳優。
名利,めいり,名誉と利益。みょうり。
名流,めいりゅう,名高い人たち。世に知られた人たち。名士。
冥慮,めいりょ,神仏などの深いおぼしめし。みょうりょ。
名論,めいろん,すぐれた論。りっぱな議論。
雌臼,めうす,碾臼(ひきうす)または磨臼(すりうす)の二つ重ねたものの、上の方の臼。
目顔,めがお,目つき。目の表情。また、顔つき。顔の表情。
妾腹,めかけばら,妾の子として生まれること。また、その人。庶子。しょうふく。
目籠,めかご,物を入れる、目を粗く編んだ竹籠。
眼形,めがたち,囲碁で、眼(め)となるような形。がんけい。
目角,めかど,１ 目の端。目尻。また、怒った目つき。２ 鋭く物を見る目。眼力。また、眼識。
眼鏡,めがね,１ 近視・遠視・乱視などの視力を調整したり、強い光線から目を保護したりするために用いる、凹レンズ・凸レンズ・着色ガラスなどを使った器具。がんきょう。２ 物の善悪・可否を見きわめること。また、その能力。めきき。３ 遠眼鏡(とおめがね)のこと。望遠鏡や双眼鏡の類。
雌株,めかぶ,雌雄異株の植物で、雌花だけをつける株。
牝狐,めぎつね,めすの狐。また、男をだます女をいう語。
目釘,めくぎ,刀身が柄(つか)から抜けるのを防ぐため、茎(なかご)の穴と柄の表面の穴とにさし通す釘。竹・銅などを用いる。目貫(めぬき)。
目口,めくち,目と口。
目凹,めくぼ,目がくぼんでいること。奥目。
盲虻,めくらあぶ,アブ科の昆虫。牛馬を襲い、血を吸うアブ。体は黒色で、翅(はね)に大きい黒紋が1個あり、腹部に黄色紋がある。
盲鰻,めくらうなぎ,１ ヌタウナギ科の魚。全長約50センチ。体は細長く、暗藍紫色。相模湾や駿河湾の深海にすむ。メクラウナギとよばれていたが、日本魚類学会が平成19年（2007）1月に改名した。２ ヌタウナギ科の魚。全長約60センチ。体は茶褐色。本州中部地方以南の海域にすむ。３ ヌタウナギ目ヌタウナギ科の魚の総称。円口類の一群。体はウナギ形で、前端に口があり、肉質の四対のひげが囲む。外鰓(がいさい)孔は一対または六対。目は退化して皮下に埋まっている。死魚などに吸着して肉を食う。この科の魚類はメクラウナギ目メクラウナギ科に分類されていたが、日本魚類学会が平成19年（2007）1月に現在の分類に改めた。ヌタウナギ1やホソヌタウナギ（旧称メクラウナギ）などが属する。
盲壁,めくらかべ,窓のない壁。
盲暦,めくらごよみ,文字を理解できない人のために絵や記号で表した暦。近世、南部藩などで行われた。絵暦。座頭暦。南部暦。
盲地,めくらじ,縦横とも紺染めの綿糸で織った無地の綿織物。紺無地。織り紺。青縞。
盲縞,めくらじま,縦横とも紺染めの綿糸で織った無地の綿織物。紺無地。織り紺。青縞。盲地。
盲蛇,めくらへび,１ 有鱗(ゆうりん)目メクラヘビ科の爬虫(はちゅう)類。全長16センチくらい。体はミミズに似て頭と胴との区別が明らかでなく、全身一様にうろこで覆われ、目は退化している。地中にすみ、シロアリなどを食う。南西諸島以南に分布。２ 物事を知らない者はその恐ろしさもわからない。無知な者は、向こう見ずなことを平気でする。
目黒,めぐろ,東京都の区名。北部を目黒川が流れる。住宅地。目黒不動・祐天寺がある。
目笊,めざる,編み目の粗いざる。
飯釜,めしがま,飯を炊く釜。飯炊き釜。
飯粒,めしつぶ,飯のつぶ。ごはんつぶ。
飯時,めしどき,食事をする時分。食事時。
飯鉢,めしばち,飯を入れておく木製の器。円形または楕円形で、ふたがある。飯鉢(めしばち)。おひつ。
