name,reading,meaning
毎朝,まいあさ,毎日の朝。
毎回,まいかい,繰り返しめぐってくる、そのたびごと。毎度。
毎期,まいき,一定の期限のたびごと。期ごと。
枚挙,まいきょ,いちいち数え上げること。一つ一つ数えたてること。
舞妓,まいこ,舞をまって酒席に興を添える少女。現在では、京都の祇園(ぎおん)の舞子が有名。
迷子,まいご,道がわからなくなったり、連れにはぐれたりすること。また、その子供やその人。まよいご。
毎号,まいごう,新聞・雑誌などの号ごと。各号。
毎次,まいじ,そのたびごと。毎回。毎度。
毎時,まいじ,1時間ごと。1時間当たり。
毎週,まいしゅう,1週間ごと。週がかわるたび。
毎食,まいしょく,食事ごと。食事のたび。
邁進,まいしん,恐れることなく突き進むこと。
枚数,まいすう,紙や板などの数。
埋設,まいせつ,地中に埋めて設置すること。
埋葬,まいそう,死体または遺骨を土中に葬ること。
埋蔵,まいぞう,１ 地中に埋め隠すこと。また、埋もれ隠れていること。２ 鉱物資源が地中に埋もれていること。
毎月,まいつき,つきづき。月ごと。まいげつ。
毎度,まいど,１ 同じ事が繰り返されること。そのたびごと。２ （副詞的に用いて）いつも。
毎日,まいにち,来る日も来る日も。日ごと。
毎年,まいねん,としごと。年々。まいとし。
毎晩,まいばん,よごと。毎夜。
毎秒,まいびょう,1秒ごと。1秒当たり。
毎分,まいふん,1分ごと。1分当たり。
埋没,まいぼつ,１ うずもれて見えなくなること。２ 世の人に知られないこと。３ 没頭して他を顧みないこと。
毎夕,まいゆう,夕方ごと。まいせき。
毎夜,まいよ,毎晩。まいや。
真上,まうえ,まっすぐ上。すぐ上。直上(ちょくじょう)。
真裏,まうら,すぐ裏。まうしろ。
前金,まえきん,１ 品物を受け取る前に代金を支払うこと。前払いすること。また、その代金。ぜんきん。２ 手付金。内金(うちきん)。まえがね。
前前,まえまえ,ずっと前。かねて。以前。
魔界,まかい,悪魔のいる世界。
真顔,まがお,まじめな顔つき。真剣な面もち。
牧場,まきば,牛・馬・羊などの家畜を放し飼いにする場所。まき。ぼくじょう。
真逆,まぎゃく,まったく逆であること。正反対なこと。また、そのさま。
魔境,まきょう,１ 悪魔や魔物の住む世界。魔界。２ どんな危険がひそむかわからない人跡まれな地域。３ 遊里や賭博(とばく)場など、人を誘惑して逃れられなくさせる場所。魔窟(まくつ)。
真際,まぎわ,物事がまさに行われようとするとき。寸前。
幕間,まくあい,演劇で、一幕が終わって、次の一幕が始まるまでの間。舞台に幕が下りている間。
間口,まぐち,土地・家屋などの正面の幅。表口。
枕元,まくらもと,寝ている人の枕のあたり。枕頭(ちんとう)。まくらがみ。まくらべ。
真心,まごころ,真実の心。偽りや飾りのない心。誠意。
真砂,まさご,細かい砂。まなご。いさご。
摩擦,まさつ,１ 物と物とがすれ合うこと。また、こすり合わせること。２ 人間の社会関係で、二者の間に意見や感情の食い違いによって起こる、不一致・不和・抵抗・紛争など。軋轢(あつれき)。３ 互いに接触している二つの物体のうち、一方が運動しようとするとき、または運動しつつあるとき、その接触面に運動を妨げようとする力が働く現象。また、その力。相対速度により運動摩擦・静止摩擦に、運動状態により滑り摩擦・転がり摩擦などに分けられる。
正夢,まさゆめ,事実と一致する夢。将来、それが現実になる夢。
真下,ました,まっすぐ下。ちょうど下。直下(ちょっか)。
魔手,ましゅ,悪魔の手。心を惑わしたり危害を加えたりして人を破滅に導く手段をたとえていった語。
魔術,まじゅつ,１ 人の心を惑わす不思議な術。魔法。２ 手品。特に、大がかりな仕掛けを用いるものにいう。
魔性,ましょう,悪魔のような、人を惑わす性質。また、それをもっていること。
麻酔,ますい,一時的に神経機能を低下させて、痛みの感覚をはじめ知覚や意識を失わせること。
益益,ますます,程度が一層はなはだしくなるさま。いよいよ。
間近,まぢか,間近いこと。また、そのさま。
街角,まちかど,１ 町の通りの曲がりかど。２ 街頭。
町中,まちじゅう,１ 町の全部。町全体。２ 町の人々全部。
町中,まちなか,住宅や商店が集まっている所。
区区,まちまち,１ まちまちで、まとまりがないさま。２ 価値が低いさま。取るに足りないさま。３ 些細(ささい)なことにこだわって、こせこせしているさま。
末裔,まつえい,末の血統。子孫。後裔。末孫。ばつえい。
末期,まっき,ある物事の末の時期。終わりに近いころ。
末期,まつご,人の死のうとする時。死に際(ぎわ)。臨終。
驀地,まっしぐら,激しい勢いで目標に向かって突き進むさま。いっさんに。
抹消,まっしょう,塗りつぶして消すこと。記載事項を消すこと。
末梢,まっしょう,１ 物のはし。末端。２ ささいなこと。３ 木の枝の先端。こずえ。
末節,まっせつ,１ 物事の本質的でない部分。２ 晩年。晩節。
末代,まつだい,１ 死んでからのちの世。後世。２ 道義の衰えた末の世。末世。
末端,まったん,１ 物のはしの部分。２ 組織などの中央から最も遠い部分。
末尾,まつび,ものの最後。終わり。
末筆,まっぴつ,文章、特に手紙の末尾にしるす文句。
末文,まつぶん,１ 文章の終わりの部分。２ 手紙文の終わりに書く形式的な文章。
末葉,まつよう,１ ある時代の終わりごろ。末期。２ 物事の大事でない部分。３ 子孫。末裔(まつえい)。ばつよう。
末路,まつろ,１ 道の終わり。２ 一生の最後。晩年。ばつろ。３ 盛りを過ぎて衰え果てた状態。なれのはて。ばつろ。４ 星新一のショートショート作品。さまざまな迷路に収録。
魔笛,まてき,１ 魔法の笛。魔力のある笛。２ モーツァルトの最後のオペラ。1791年に作曲され同年ウィーンで作曲者の指揮により初演された。２幕からなり，台本は，俳優・歌手・台本作家として知られたドイツ人E.シカネーダー〔1751-1812〕。エジプトの王子タミーノと夜の女王の娘パミーナ，鳥さしのパパゲーノとパパゲーナが結ばれるまでの童話的なオペラで，ドイツ語で書かれたジングシュピールとして，その後のドイツのオペラの発展の出発点ともなった。ベルイマンにより映画化（1975年）もされている。
的射,まとい,的を置いて矢を射ること。
窓際,まどぎわ,窓に近いあたり。窓のそば。
窓口,まどぐち,１ 窓になっている所。２ 外来者と直接応対して用件の処理や書類・金銭の受け渡しなどをする係・部署。３ 外部との折衝や交渉をするところ。
窓辺,まどべ,窓のそば。窓の近く。
正面,まとも,１ まっすぐに向かい合うこと。正しく向かい合うこと。また、そのさま。真正面。２ 策略や駆け引きをしないこと。また、そのさま。３ まじめなこと。正当であること。また、そのさま。
微睡,まどろみ,まどろむこと。
愛娘,まなむすめ,かわいがっている娘。
真似,まね,１ まねること。また、形だけ似た動作をすること。模倣。２ 行動。ふるまい。
麻痺,まひ,１ しびれて感覚がなくなること。しびれ。２ 通常のはたらきや動きが停止すること。３ 脳・神経や筋肉が働かなくなって、運動機能や精神作用・知覚機能が失われること。
真昼,まひる,昼の最中。正午ごろ。白昼。
目深,まぶか,目が隠れるほど、帽子などを深くかぶるさま。めぶか。
真冬,まふゆ,冬のさなか。《季 冬》
魔法,まほう,人間の力ではなしえない不思議なことを行う術。魔術。
間間,まま,１ 頻繁ではないが、時々現れるさま。時おり。２ 物と物とのあいだ。あいだあいだ。
飯事,ままごと,子供が玩具を使って炊事や食事などのまねごとをする遊び。ままごと遊び。
真水,まみず,１ 塩分などのまじらない水。淡水。さみず。２ 国の経済対策のうち、政府が直接負担する財政支出のこと。公共投資・減税など、同年度の経済成長率を直接押し上げる要素となるものを指す。真水ベースで対国内総生産（GDP）何パーセントの経済対策などと表す。３ 大部分が直接企業の収益となる売上。また、現金のこと。
摩滅,まめつ,すりへること。すれてなくなること。
豆粒,まめつぶ,豆の粒。ごく小さいもののたとえに用いる。
豆本,まめほん,きわめて小型の本の総称。外国では、好事家に珍重される。
摩耗,まもう,かたい材質の物が、すりへること。特に、機械の部品や道具にいう。
魔物,まもの,１ 魔性のもの。妖怪ようかい。ばけもの。２ 人を迷わせたり破滅に導いたりするもの。
眉頭,まゆがしら,眉の、眉間(みけん)に近い部分。びとう。
眉尻,まゆじり,眉のこめかみに近い方。
眉根,まゆね,１ 眉の根もと。眉毛の内側の方。まよね。２ まゆ。まよね。
真横,まよこ,ちょうど横。また、水平。
魔力,まりょく,人を惑わし、また引きつける不思議な力。まりき。
丸腰,まるごし,武器を全く持たないこと。
丸損,まるぞん,利益が全くなく、すっかり損をすること。
丸裸,まるはだか,１ からだに何もつけていないこと。あかはだか。まっぱだか。すっぱだか。２ 自分のからだのほかは、全然所有物のないこと。無一物。３ （比喩的に）木の葉が全部落ちてしまった状態。また、枝を切られて幹だけの状態。４ （比喩的に）すっかりさらけ出すこと。または、さらけ出されること。
丸秘,まるひ,秘密書類であることを示す㊙のしるし。転じて、秘密にすべきこと。また、そのもの。
丸丸,まるまる,１ ある事物を伏せて暗示するときに用いる符号。「〇〇」と書く。２ 二重の圏点。二重丸。３ 団子(だんご)をいう女房詞。４ よく太っているさま。５ ある数量や事柄の全体に及ぶさま。完全に。６ 全く。すっかり。
真綿,まわた,くず繭などを煮て引き伸ばして作った綿。じょうぶで軽く、保温力が大きい。
万一,まんいち,１ 万の中に一つ。めったにないが、ごくまれにあること。まんがいち。２ めったにないことが起こるのを予測するさま。もしも。まんがいち。
満員,まんいん,定員に達すること。また、余地がないほど人がいっぱいにはいっていること。
満悦,まんえつ,心が満ち足りてよろこぶこと。
蔓延,まんえん,つる草がのび広がること。病気や悪習などがいっぱいに広がること。
漫画,まんが,１ 単純・軽妙な筆致で描かれた、こっけい・誇張・風刺・ナンセンスなどを主とする絵。２ 絵を連続させ、多くは台詞(せりふ)を伴って物語風にしたもの。
満開,まんかい,花が十分に開くこと。また、すべての花が開くこと。はなざかり。
満額,まんがく,要求や計画どおりの金額。
満期,まんき,期限が来ること。一定の期日に達すること。また、その時期。
満喫,まんきつ,１ 存分に飲み食いすること。２ 十分に楽しむこと。
満月,まんげつ,１ 全面が輝いて円く見える月。月と太陽の黄経の差が180度になったときに起こる。十五夜の月。望(ぼう)。もちづき。２ 琵琶の部分の名。隠月(いんげつ)の異称。３ 星新一のショートショート作品。つねならぬ話に収録。
満載,まんさい,１ 車・船などに荷物や人をいっぱいのせること。２ 新聞・雑誌に記事をたくさんのせること。３ ある性質がはなはだしいこと。
漫才,まんざい,二人の芸人がこっけいなことを言い合って、客を笑わす寄席演芸。
満更,まんざら,１ （あとに否定的な語を伴って）否定的な意味をさらに強める気持ちを表す。全く本当に。２ （否定的な語のあとにさらに打ち消しの語を伴って）否定の意味をやわらげたり、むしろ逆であるの意味を表したりする。必ずしも。３ 全くだめであるさま。４ 困難なさま。こまりはてるさま。
満室,まんしつ,１ すべての部屋がふさがって空きがないこと。２ その部屋をいっぱいにしていること。
満車,まんしゃ,駐車場などに車がいっぱいで、それ以上は入れないこと。
満場,まんじょう,会場に満ちていること。会場全体。また、その場にいる人すべて。
慢心,まんしん,おごり高ぶること。また、その心。自慢する気持ち。
満身,まんしん,からだじゅう。全身。
満水,まんすい,水がいっぱいに満ちること。
慢性,まんせい,１ 症状はあまりひどくないが、治りにくく、経過が長びく病気の性質・状態。２ 望ましくない状態が長く続くこと。
満席,まんせき,乗り物や劇場などの座席がすべてふさがること。
万善,まんぜん,あらゆる善事。数多い善行。
漫然,まんぜん,とりとめのないさま。ぼんやりとして心にとめないさま。
満足,まんぞく,１ 心にかなって不平不満のないこと。心が満ち足りること。また、そのさま。２ 十分であること。申し分のないこと。また、そのさま。３ 数学で、ある条件を満たしていること。
漫談,まんだん,１ くつろいだ気分でする、とりとめもない話。２ 寄席演芸の一。軽妙な口調で、社会風俗・時事問題の風刺・批評なども取り入れて、聴衆を笑わせる話芸。大正末ごろ、トーキー映画の発達で職を失った活動写真の弁士らが始めた。
満天,まんてん,空に満ちていること。また、空いっぱい。空一面。
満点,まんてん,１ 規定の点数の最高点。また、それに達すること。２ 申し分のないこと。非難すべきところがないこと。
満杯,まんぱい,１ 容器がいっぱいになること。２ 収容できる人員がいっぱいになること。予定した数量に達すること。
万病,まんびょう,あらゆる病気。多くの病気。
満腹,まんぷく,１ 腹がいっぱいになること。飽腹(ほうふく)。２ 多く、「満腹の」の形で、心からの、満身の、などの意を表す。
満遍,まんべん,１ 残るところがないこと。全体。２ 禅宗で、平均・平等の意。
漫漫,まんまん,広々と果てしないさま。
満満,まんまん,満ちあふれているさま。満ち満ちているさま。
満面,まんめん,顔じゅう。顔いっぱい。
漫遊,まんゆう,気の向くままに各地を回って旅すること。
満了,まんりょう,一定の期間がすっかり終わること。
真赤,まあか,純粋な赤。まっか。
真鰺,まあじ,アジ科の海水魚。全長約40センチ。体は紡錘形で側扁し、体側を「ぜんご」とよぶ硬いうろこが1列走る。背面は暗緑色、腹面は銀色。北海道以南の沿岸域を群泳し、夏季に北上する。食用。あじ。
真網,まあみ,2艘(そう)の船で網漁をするとき、右方の船に積む袋網と右側の袖網(そであみ)。また、真網船。
毎秋,まいあき,秋の季節ごと。毎年の秋。まいあき。
舞扇,まいおうぎ,舞をまうときに用いる扇。多くは、色彩の美しい大形の扇。
毎夏,まいか,夏の季節ごと。毎年の夏。まいなつ。
舞衣,まいぎぬ,１ 舞をまうときに着る衣服。舞衣装。まいごろも。２ 能装束の一。長絹(ちょうけん)に似て、脇から裾まで縫いとじてある広袖(ひろそで)の単(ひとえ)の上衣。女神や竜女などに用いる。
埋却,まいきゃく,地中などにうめること。また、うまること。
舞車,まいぐるま,祭礼のときに出す山車(だし)。
埋骨,まいこつ,死者の骨を土中に葬ること。
毎歳,まいさい,毎年。としごと。
舞阪,まいさか,静岡県浜松市の地名。旧町名。浜名湖口の東岸に位置し、もと東海道の宿場町。ウナギの養殖が盛ん。弁天島があり、観光地。
昧者,まいしゃ,おろかもの。愚者。
毎春,まいしゅん,春の季節ごと。毎年の春。まいはる。
埋草,まいそう,青刈り飼料をサイロなどに詰め、乳酸発酵させて貯蔵した家畜飼料。エンシレージ。
舞茸,まいたけ,サルノコシカケ科のキノコ。秋にクリ・ナラなどの大木の根元に生える。茎はよく分岐し、多数の傘が重なり合って大きな塊状となり、表面は灰白色または暗褐色で裏面は白い。美味。
舞鶴,まいづる,１ 舞っているツル。２ 紋所の名。ツルが翼を広げた姿をかたどったもの。３ 京都府北部、若狭湾に面する市。西舞鶴はもと田辺といい、京極・牧野氏の城下町、商港として発展。東舞鶴は旧海軍の軍港。第二次大戦直後は引き揚げ港となった。
毎冬,まいとう,冬の季節ごと。毎年の冬。まいふゆ。
舞殿,まいどの,神社の境内に設けた、舞楽を行うための建物。神楽殿(かぐらでん)。
舞人,まいにん,舞を舞う人。特に、舞楽を舞う人。ぶにん。まいにん。
舞萩,まいはぎ,マメ科の小低木。高さ約80センチ。葉は3枚の長楕円形の小葉からなる複葉で、頂の小葉が長く、側小葉は温度と光線の加減で上下運動をする。秋、紅色がかった淡黄色の花を総状につける。熱帯アジアなどに分布。
米原,まいばら,滋賀県北東部にある市。琵琶湖東岸から伊吹山地に広がる。太平洋側と日本海側とを結ぶ鉄道・道路交通の要地。平成17年（2005）2月に山東町、伊吹町、米原(まいはら)町が合併して成立。同年10月に近江町を編入。
舞姫,まいひめ,１ 舞を舞う女性。踊り子。ダンサー。２ 五節(ごせち)の舞に出る少女。
巻文,まいぶみ,巻物仕立てにされた文書。まきぶみ。
舞舞,まいまい,１ 曲舞(くせまい)およびそれから派生した幸若舞(こうわかまい)の異称。２ カタツムリの別名。３ 甲虫目ミズスマシ科の昆虫。川や池の水面をくるくる回って泳ぎ、体長7ミリくらい。背はやや膨らみ、長卵形で滑らかで、黒褐色。幼虫は水生で、成虫とともに肉食。まいまいむし。うずむし。
毎葉,まいよう,葉・紙などの1枚ごと。各葉。
真鰯,まいわし,１ ニシン目ニシン科の海水魚。全長約20センチ。体は細長く、やや側扁する。背側は青緑色で、体側に1～3列の黒点が並ぶ。植物プランクトンを主食とし、沿岸の表層を回遊する。食用、また養魚の餌とする。大きさにより、しらす・ひらご・小羽・中羽・大羽とよばれる。ななつぼし。いわし。
前石,まえいし,役石(やくいし)の一。蹲踞(つくばい)や石灯籠(いしどうろう)の前に据える石。
前板,まえいた,１ 額の上部の頭髪。２ 女子または元服前の男子の額の上の髪を別に束ねたもの。向こう髪。３ 前髪姿の男子。元服していない少年。
前緒,まえお,履物の前壺(まえつぼ)にすげる緒。
前帯,まえおび,１ 帯を前で結ぶこと。また、その帯。江戸時代、既婚の女性などが多く用いた。前結び。２ 近世の上方で、まゆをそり、歯を黒く染めた年増(としま)。
前頭,まえがしら,相撲で、小結の次位、十両の上位。定数はないが、通例東西15人前後で、その第1位を前頭筆頭といい、以下前頭何枚目と数える。
前方,まえかた,１ 前後や序列の、先の方。前側の方。２ 前の方向。ぜんぽう。３ 以前。先ごろ。４ 事前。あらかじめ。５ 時代遅れなこと。また、そのさま。６ 不慣れなこと。また、そのさま。未熟。７ 控えめであること。また、そのさま。
前廉,まえかど,１ 以前。先ほど。まえかた。２ 事前。前もって。まえかた。
前髪,まえがみ,１ まるい鏡。２ まるい月。満月。３ 丸餅。鏡餅。
前神,まえがみ,二座以上の神を祭った神社で、主神以外の神のこと。
前桐,まえぎり,箪笥(たんす)などで、前部の板だけに桐材が使ってあること。また、そのもの。総桐などに対していう。
前句,まえく,連歌・俳諧で、付句(つけく)の前に位置する句。
前芸,まえげい,本芸に入る前に小手調べとして演じるちょっとした芸。
前腰,まえごし,袴(はかま)の前側のひもの、腹に当たる部分。
前先,まえさき,将来。また、将来を見抜くこと。
前裾,まえすそ,着物やスカートの下のへりで、前方の部分。
前壺,まえつぼ,下駄などの、鼻緒の前緒をすげる穴。また、その前緒。
前歯,まえば,１ 口の中の前面に並んだ上下4枚ずつの歯。切歯(せっし)。門歯。２ 下駄などの、前方の歯。
前橋,まえばし,群馬県中南部の市。県庁所在地。もと厩橋(うまやばし)といい、酒井・松平氏の城下町。江戸から大正時代、絹織物業で栄えた。平成16年（2004）に大胡(おおご)町・宮城村・粕川村を、平成21年（2009）に富士見村を編入。
前幅,まえはば,和裁で、前身頃(まえみごろ)の幅。また、その寸法。着物では脇縫目(わきぬいめ)から衽(おくみ)つけまで、ジュバン・羽織では襟つけまでの幅。
前原,まえばる,福岡県北西部にあった市。近世、宿場町・市場町として発展。平成22年（2010）に二丈町・志摩町と合併して糸島市になった。
前日,まえび,当日の前の日。ぜんじつ。
前褌,まえみつ,相撲で、まわしを締めたとき体の前面で横になっている部分。前まわし。
前厄,まえやく,厄年(やくどし)の前の年。厄年に次いで慎むべき年とされる。
前輪,まえわ,１ 前の方の車輪。２ 鞍橋(くらぼね)の前部の山形に高くなっている部分。
魔王,まおう,１ 仏道修行や善事を行おうとする気持ちを妨げる天魔の王。欲界の第六天の王。２ 人に災いを与えたり、悪の道に陥れたりする魔物。
麻黄,まおう,マオウ科の常緑小低木。高さ30～70センチ。茎は緑色で、外観はトクサに似る。葉は白い鱗片(りんぺん)状で、対生。雌雄異株。夏、小さな卵形の花穂をつける。地上茎を漢方で発汗・解熱・鎮咳(ちんがい)・利尿薬に用いる。中国北部・モンゴルに分布。
真岡,まおか,ロシア連邦サハリン州（樺太）の都市ホルムスクの、日本領時代の名称。
摩訶,まか,仏語。優れていること。大きいこと。偉大なこと。他の語や人名の上に付いて美称として用いることも多い。
禍神,まがかみ,災いをなす神。邪神。悪神。
間数,まかず,部屋の数。室数。
魔風,まかぜ,悪魔が吹かせ、人を誘う風。
真鉋,まかな,鉋(かんな)の美称。
真鴨,まがも,カモ科の鳥。全長約60センチ。雄は青首(あおくび)ともよばれ、頭部が濃緑色で、白い首輪があり、胸が栗色、くちばしは黄色。雌は全体に黄褐色。北日本で繁殖しているが、冬鳥としても池・湖に渡来。アヒルの原種。
真鰈,まがれい,カレイ科の海水魚。全長約40センチ。体は楕円形で平たく、口は小さい。両眼は体の右側にある。有眼側は淡褐色で、無眼側には黄色の帯がある。北日本に多く、美味。くちぼそ。
真雁,まがん,カモ科の鳥。全長72センチくらい。全体に灰褐色、くちばしが桃色で額が白い。ユーラシア・北アメリカ北部で繁殖。日本には冬鳥として渡来し、ガンでは最も数が多い。かり。
